titel,bewohner,groesse,miete,strasse,plz,online_seit,sentiment,verbindung,verbindung_moeglich,zimmer,lage,wg_leben,sonstiges,link
wunderschöne 3er WG in top Lage mitten auf der Ponte,3,11,320,Pontstr,52062,264.0,-0.8127,False,False,Hi ich bin Paul und Ich ziehe nach   sehr schönen Jahren aus der WG aus     Die Wohnung wurde uns saniert übergeben und seitdem hat sie nichts von ihrem Glanz verloren  Sie liegt in einem Innenhof und steht quasi frei  Der einzige direkte Nachbar ist ein Reisebüro  Was die Wohnung ausmacht ist ein wunderschöner Boden  viel Licht  ein sauberes und hochwertiges Bad und eine große Küche     Nicht zu vergessen ist außerdem das sehr angenehme WG Leben  aber dazu später mehr     Wie im Grundriss zu sehen  ist dein zukünftiges Zimmer   qm groß und hat genau wie der Rest der Wohnung sehr hohe Decken  Es gibt ein großes Fenster mit Blick in den Innenhof ,Die Wohnung liegt direkt auf der Pontstraße und befindet sich in direkter Uninähe  So kommst du fußläufig innerhalb von  -   Minuten zu den wichtigsten RWTH Gebäuden  Netto und Rewe erreichst du innerhalb von   Minuten zu Fuß  Falls du mal nicht kochen möchtest  findest du eine Vielzahl an Gastronomien und Bars auf der Pontstraße  Innerhalb von    min kommst du zu Fuß in die Innenstadt     Die Busstationen Ponttor und Driescher Gässchen befinden sich direkt vor der Haustür  von dort aus sind alle Stadtteile Aachens gut zu erreichen  Aachen HBF     min  Aachen West    min  ,Unser bisheriges WG-Leben basierte immer auf einem freundschaftlichen Miteinander  Wir unternehmen gerne mal was zusammen wie etwa gemeinsame Koch- und Filmabende  Wenn man sich über den Weg läuft quatschen wir auch mal gerne      Uns ist eine offene Kommunikation wichtig  vorallem falls es Unstimmigkeiten gibt  Mit unseren Nachbarn verstehen wir uns sehr gut und bisher gab es keine Probleme     Damit wir nicht im Dreck versinken  haben wir einen Putzplan  der im   Wochen Rhytmus rotiert     Für gemeinsame Ausgaben benutzen wir die App Splid      Zu deinen zukünftigen Mitbewohnern      Lara     Hallo ich bin Lara     Jahre alt und studiere im    Semester Wirtschaftsingenieurwesen FR Maschinenbau an der RWTH Aachen und ich werde auch meinen Master hier machen     Ich komme ursprünglich aus Kleinenbroich  ein Dorf in der Nähe von Mönchengladbach  und bin      nach Aachen gezogen     Ich selbst würde mich als einen sehr offenen Menschen bezeichnen  der gerne neue Leute kennenlernt     In meiner Freizeit bin ich am liebsten mit Freuden unterwegs  gehe Schwimmen oder Segeln     Ich bin immer für einen lustigen Abend zu haben  natürlich auch mal mit einem guten Glas Wein oder einem Gin Tonic       Ich freu mich auf ein angenehmes WG Leben      Linda     Hallöchen  ich bin Linda  aktuell    Jahre alt und ich schreibe gerade meine Bachelorarbeit in Informatik an der RWTH      Ich bin zwar erst letztes Jahr von Düren nach Aachen gezogen  doch mittlerweile habe ich mich gut eingelebt  Beschreiben würde ich mich als offen  spontan  mal mehr mal weniger organisiert und für vielen Spaß zu haben      Hobbymäßig bin ich gerne unter Freunden  zum Quatschen oder was Trinken  ich backe manchmal  wenn ich Zeit hab  und versuche mich bei kreativen Dingen gegen meinen Perfektionismus zu wehren  Davon abgesehen pendel ich momentan auch ab und zu nach Köln  Prokrastinieren tue ich am liebsten in Gesprächen innerhalb der WG  um sicher zu gehen  dass noch keiner angefangen hat für die Klausuren zu lernen      Ich freue mich auf Dich und ein neues gemeinsames WG-Leben   ,Wenn gewollt  können das Bett und der Schrank für einen Abschlag übernommen werden  Beim Schrank wird dann jedoch die Spiegeltür durch eine normale Tür ersetzt ,https://www.wg-gesucht.de/wg-zimmer-in-Aachen-Aachen.7392589.html
"Helles Zimmer in wunderschöner Altbau-WG mit super Lage - 1,5 Monate Untermiete",3,15,480,Boxgraben,52064,264.0,-0.47262499999999996,False,False,Hey zukünftige r Mitbewohner in         Dein Zimmer ist etwa   m  groß und hat eine gemütliche Empore  auf der man auf einem gemütlichen     m Bett schläft  sowie einen Erker  wo ein Schreibtisch steht   Wie auch der Rest der Wohnung ist dein Zimmer schön hell durch die hohen Decken im Altbaustil und die großen Fenster     Die Möbel  Schreibtisch  Schreibtischstuhl  Fernseher  Sofa  Kommode  Lattenrost  Matraze  Regal   Kleiderschrank  würde ich gerne im Zimmer lassen  da ich nach der Untermietzeit ja wiederkomme      Die gesamte Wohnung ist      frisch saniert worden und hat ein modernes Bad  eine moderne Küche  sowie ein separates Wohn- und Esszimmer  Wir haben den Luxus einer Spülmaschine in der Küche und eine Waschmaschine im Keller   Im Innenhof gibt es eine Überdachung  wo man sein Fahrrad abstellen kann ,Die Wohnung liegt direkt an der Schanz und somit sehr zentral     Busstationen und der Bahnhof Schanz kannst du innerhalb einer Minute erreichen   Zu Fuß bist du in    min beim Carl und mit Bus und Fahrrad gehts noch schneller   Höchstens   min zu Fuß ist auf der Lütticher Straße ein gut ausgestatteter Rewe und innerhalb von ca     min fußläufig gibt es auch einen Aldi und Edeka  Geht man die Jakobstraße runter ist man in    min am Markt   Der Westpark ist auch direkt um die Ecke und eignet sich vor allem im Sommer zum lernen  chillen  bräunen und Spikeball spielen   Der Hangeweiher ist auch gut zu Fuß erreichbar und insbesondere fürs Joggen und Freibad interessant ,Momentan machen wir ab und zu gemeinsame WG Abende in denen wir Serien gucken  Spielabende veranstalten  in den Park gehen oder zusammen kochen       Wir würden uns also freuen  wenn wir ab und zu wir etwas zusammen unternehmen würden      Jetzt zu uns      Hi  Ich bin Emma     Jahre alt und studiere im    Semester Soziologie mit Schwerpunkt Technikforschung an der RWTH     Ich bin ein unternehmungsfreudiger und aufgeschlossener Mensch     In meiner Freizeit spiele ich Tennis  höre viel Musik und lese gerne     Ansonsten bin ich mit meinen Freunden unterwegs  öfter auch mal feiern  und bin auch offen für WG und Spieleabende zusammen      Hi  ich bin Jacob     Jahre alt und studiere jetzt im    Bachelor Semester an der RWTH Maschinenbau  Ich würde sagen ich bin ein offener und unkomplizierter Mensch  der auch immer gerne bei gemeinsamen WG Abenden dabei ist  In meiner Freizeit reise und feier ich gerne  gehe viel ins Kino und lese hin und wieder mal ein Buch  Ansonsten bin ich gerne kreativ tätig und handwerke oder programmiere das ein oder andere ,Bitte beachte  dass das Zimmer nur befristet zur Untermiete für ein anderthalb Monate zu vermieten ist     Nun stell dich uns gerne vor       Um zu bestätigen  dass du den ganzen Anzeigentext wirklich gelesen hast  erwähne doch bitte auch dein Lieblingsgericht       Wenn du sonst noch irgendwelche Fragen hast  frag uns einfach  Wir freuen uns auf dich  ,https://www.wg-gesucht.de/wg-zimmer-in-Aachen-Aachen.7392589.html
WG Zimmer in 3er WG in Rothe Erde / nähe Frankenberger Viertel,3,18,450,Adalbertsteinweg,52066,264.0,-0.83675,False,False,Ich suche jemanden der mein schönes WG Zimmer übernimmt  da ich mit meinem Studium fertig bin      Das Zimmer hat zwei große Fenster und ist dadurch immer hell  Es gibt auch Rollläden mit denen man das Zimmer sehr gut abdunkeln kann  Durch die L -Form des Zimmers  ergibt sich eine praktische Raumaufteilung  wodurch du all deine Sachen gut verstauen kannst  Das Zimmer liegt zwar direkt an der Hauptstraße  jedoch kann man dennoch gut in dem Zimmer Arbeiten und wird nicht großartig gestört      Da sich die Wohnung im Erdgeschoss befindet  ist die Wohnung immer angenehm kühl im Sommer     Die Küche ist auch gut ausgestattet mit einer Spülmaschine  Backofen  vier Herdplatten und ausreichend Töpfen  Geschirr und Besteck ,Die Wohnung befindet sich im Stadtteil Roth Erde   Frankenberger Viertel und liegt direkt an der Josefskirche     Man braucht nur   min bis zu Netto oder Rewe  Bis zum nächsten Imbiss sind es auch nur   min  ob Bäcker  Pizza  Döner oder Asiatisch du hast hier eine gute Auswahl      Die nächste Bushaltestelle  Josefskirche  ist keine   min entfernt von der Wohnung und der Bahnhof Rothe Erde ist auch in weniger als in    min zu erreichen  Je nachdem  wo du in Aachen zur Uni gehst  bist du in   -   min da      Gegenüber von der Wohnung befindet sich ein Schwimmbad und in    min bist du bei McFit oder Fit X     Ins Zentrum von Aachen brauchst du mit dem Bus    min und in   min bist du mit dem Bus bei dem Einkaufszentrum Aquis Plaza  wo du so gut wie alles bekommst  Wir verbringen die Zeit gerne draußen auf unserer Terrasse  oder in dem nahe gelingenden Kennedy Park ,Du wirst mit Leonard      Architektur Student zusammen wohnen  Wir verbringen die meiste Zeit zusammen beim Kochen   spielen Karten bei einem gemütlichen Bier auf der Terrasse  schauen im Wohnzimmer einem Film oder hören zusammen Musik und chillen einfach      Da der dritte WG-Mitbewohner ebenfalls auszieht  wird ein weiteres Zimmer bald auch frei  wodurch du theoretisch mit einem weiteren Freund einziehen könntest ,Ich würde das Regal  die Ikea-Kleiderstange  die eine Wandlampe gegen Aufpreis       da lassen      Bei Bedarf auch das Bett mit dem stylischen Bettgestell  Bett        Über den Preis können wir ja noch verhandeln      In dem Mietpreis ist alles mit enthalten Gas und Wasser enthalten  Die finale Miethöhe muss mit dem Vermieter abgestimmt werden     Strom   Internet kommen on top      Bei Interesse gerne auch über WhatsApp kontaktieren ,https://www.wg-gesucht.de/wg-zimmer-in-Aachen-Aachen.7392589.html
Penthouse WG Zimmer in zentraler Lage mit großem Gemeinschaftsbereich,4,12,390,Heinrichsallee,52062,264.0,-0.52855,False,False,Hi        In unserer  er WG wird ein Zimmer frei  da unsere bisherige Mitbewohnerin auszieht  Das Zimmer hat etwa   qm und eine Dachschräge mit großem Dachfenster  Der Kleiderschrank kann bei Bedarf auch in den Gemeinschaftsbereich gestellt werden  Unsere Vormitbewohnerin würde gerne ihre Möbel gegen eine kleine Abschlagszahlung im Zimmer lassen  Dies beinhaltet einen Kleiderschrank  Palettenbett  Schreibtisch  Schreibtischstuhl  und ein kleines Regal  Wenn du selbst Möbel mitbringen möchtest geht das auch    Die WG besticht mit ihrem riesigen Gemeinschaftsbereich  der sowohl Esszimmer  Küche und Wohnzimmer  als auch Tischkicker und Dartscheibe enthält  Abgerundet wird der gemeinsame Bereich durch einen   qm Balkon am ganzen Haus entlang  auf dem im Sommer perfekt gegrillt und auf der Palettencouch gechillt werden kann     Die WG hat zwei vollausgestattete Badezimmer  das eine ist allerdings direkt mit einem der anderen Zimmer verbunden  Kann aber auch genutzt werden ,Die WG befindet sich im   Stock  man bleibt also fit  wenn man diese teils mehrfach täglich hoch und runter geht  D Von der großen Terrasse aus hat man einen weiten Blick auf den Hinterhof      Die Wohnung befindet sich zwischen Kaiserplatz und Hansemannplatz und ist somit sehr zentral gelegen    Minuten zum Rewe und zum Einkaufszentrum Aquis Plaza  Die Bushaltestellen Kaiserplatz und Hansemannplatz befinden sich jeweils   Minute von der Haustüre entfernt ,Wir suchen eine n passende n Mitbewohner in für das frei werdende Zimmer  Da wir sehr gute Freunde sind haben wir ein reges WG Leben und unternehmen viel zusammen  Falls du lieber dein eigenes Ding machen willst ist das auch kein Problem  Unser WG Leben besteht aus zusammen kochen  ins Gym gehen  am Wochenende Freunde einladen oder feiern gehen     Deine neuen Mitbewohner sind Lukas  im Bachelor an der RWTH  Fiona momentan im Home-office und Janis  grade mit dem Master fertig und jetzt arbeitssuchend ,Wir freuen uns auf eure Anfragen  Alles Weitere können wir gerne bei einer Besichtigung besprechen ,https://www.wg-gesucht.de/wg-zimmer-in-Aachen-Aachen.7392589.html
Zimmer in 5er WG,5,19,430,Jupp-Müller-Str,52072,264.0,-0.22460000000000002,False,False,Dachgeschosszimmer nähe Haltestelle Jupp-Müller-Straße  fußläufig zu Universität und Süsterau Gewerbegebiet  in der Umgebung gibt es   Supermärkte und Fitnessstudio  optimal für Berufspendler und Studierende     Mitbenutzung von   gemeinsame Küche und   Badezimmer von   Mitbewohner  Die Mietkosten       enthält Heizung  Wasser  Internet und Nutzung von Waschmaschinen   Trockner im Keller  Haustiere nach Absprache mit dem Vermieter     Das Zimmer ist mit Bettrahmen und Lattenrost  m    m   einem Schreibtisch  Kleiderschrank und Drehstuhl ausgestattet      Besichtigungstermin auf Anfrage  bitte Termin Vorschläge mitbringen ,zu Fuß       Min zur Bushaltestelle Jupp-Müller-Straße      Min zum WOF Fitness Studio      Min aufs Lousberg      Min zu Lidl      Min zu Obi       Min zu Aldi       Min nach Ponttor       Min nach Westbahnhof K A R L        Min nach Lindt Werksverkauf       Min nach Super-C     Min mit dem Bus  ,Jeder muss proaktiv Küche bereinigen und Mülltonne rausstellen    Haftpflichtversicherung und Hausratversicherung erforderlich ,Mindest Mietdauer     Monate     Haftpflichtversicherung erforderlich      Besichtigung nach Absprache  Bitte unbedingt zuerst Termin vereinbaren  sonst wird Türklingel nicht beantwortet     Solange die Anzeige noch online ist  ist die Wohnung noch verfügbar ,https://www.wg-gesucht.de/wg-zimmer-in-Aachen-Aachen.7392589.html
Cozy room in WG,3,12,325,Ludwigsallee,52062,264.0,0.49292500000000006,False,False,  m room in   persons WG available  Already with everything you need  Bed  Sofa  Table   Wardrobe ,The location is perfect  The nearest Busstop  Ehrenmal Lousberg  is just   minutes away  Rewe is just   minutes away and Netto    minutes away  The location is perfect wether you want to take a walk down the park  buy groceries  go to a restaurant or a Party  It s near all the main RWTH buildings but also has good Bus connections to the FH buildings ,We are three south American students  sadly Nicolas is leaving us  Martina      is from Chile and is currently studying Psychology and Esteban      from Colombia is doing its PHD in geology on the RWTH  We like to spend time together cooking  watching movies   series  playing video games and board games or having a beer  Of course we also value privacy and silence specially during exams periods ,In order to see that you read all the descriptions  we would like to know which is your favorite Pokemon ,https://www.wg-gesucht.de/wg-zimmer-in-Aachen-Aachen.7392589.html
Zimmer in 4er-WG zu vermieten,4,22,380,Krefelder,52070,264.0,-0.8283,False,False,Zu Vermieten gibt es ein geräumiges Zimmer mit   Fenstern und Teppichboden  Vor Einzug wird vom Vormieter nochmal gestrichen und der Teppichboden gereinigt       Die Wohnung kommt mit einem Bad mit Dusche und einer zweiten Toilette  also gibt es morgens eigentlich selten Probleme        Die Miete beinhaltet sowohl Internet als auch GEZ  Die Kaution von     Euro würdest du vom Vormieter übernehmen  Der Vormieter würde sich außerdem über eine kleine Ablösesumme für den WG-Trockner sowie eventuell andere übernommene Dinge freuen  auf Verhandlungsbasis  ,Die Buslinie    fährt in der Woche alle    Minuten die wichtigen Punkte bzw  Umstiegsmöglichkeiten an       Die Innenstadt ist aber auch nicht weit entfernt und ist ohne Probleme zu Fuß erreichbar  Bequem ein Eis in der Innenstadt zu essen  ist also gar kein Problem      Als Supermarkt hat man nebenan den Hit  etwas weiter weg auch ein Aldi ,Das WG Miteinander war immer unproblematisch  da großer Wert auf offene Kommunikation gelegt wird       Auch wenn man gemeinsam kocht oder auch mal was spielt  wird die eigene Privatsphäre des Zimmers natürlich trotzdem immer respektiert ,Da ich aus der Wohnung ausziehe und ein neue r Mitbewohner in natürlich zu den Anderen passen muss  werden sich also die zukünftigen und potentiellen Mitbewohner sich bei dir melden      Bitte beachte  Da wir aus diversen Gründen  Prüfungen  Auslandssemester  Urlaub  gerade nicht alle vor Ort in Aachen sind  kann es ein paar Tage dauern  bis wir uns bei dir zurück melden ,https://www.wg-gesucht.de/wg-zimmer-in-Aachen-Aachen.7392589.html
WG Zimmer am Elisenbrunnen zur Untermiete frei☺️,3,8,390,Wirichsbongardstraße,52062,264.0,-0.253975,False,False,Huhu   Bei uns wird ein Zimmer in der WG frei  weil unser Mitbewohner sein Wintersemester in Norwegen verbringt  Die genauen Ein- und Auszugsdaten stehen noch nicht ganz fest und können auch näher besprochen werden     Zur Wohnung    Wir wohnen in einem Hinterhaus mit einem kleinen Fahrradhof  Die Wohnung erstreckt sich über das EG und OG  wobei die Eingangstür im ersten Stock ist  Alle unsere Zimmer sind klein  Dafür haben wir zwei Wohnzimmer  die mit einer Wendeltreppe verbunden übereinander liegen  Oben steht auch ein großer Esstisch an dem Vincent und ich oft lernen  Dein Zimmer hat ein Oberlicht  welches automatisch geöffnet werden kann  Der Kleiderschrank steht im unteren Wohnzimmer  um dem Zimmer etwas mehr Platz zu geben  Zusätzlich zum oberen Bad haben wir noch ein kleines unten  welches wir vor allem als extra WC nutzen ,Wir wohnen super zentral direkt in einer Seitenstraße am Elisenbrunnen  Damit bist du in sehr kurzer Zeit an Bushaltestellen  aber auch mitten im Zentrum  Caf s  Döner  Restaurants etc  Der Alte Posthof ist auch sehr schnell erreichbar  Rewe   sowie ein Aldi und ein Netto  Beide Unis sind von hier sehr gut zu erreichen ,Du wirst mit mir  Franzi  und Philipp zusammen wohnen  Ich bin     im Sommer dann     und studiere Architektur an der RWTH  Ich gehe gerne Wandern  auf Festivals  Konzerte  und sitze sehr gerne in Caf s  Trotzdem bin ich auch gerne Zuhause und am Laptop       Philipp ist    hat eine Ausbildung zum Fachinformatiker gemacht und beginnt im Juli eine Umschulung zum Lokführer  Er sitzt viel vorm PC und ist auch für viele Unternehmungen zu begeistern   Wir spielen beide Klavier und haben zwei E-Pianos in der WG stehen   Wir verbringen gerne Zeit zusammen  machen Spieleabende oder kochen gemeinsam  Außerdem tauschen wir uns oft über unser Leben aus und quatschen einfach viel     Es ist aber auch nie ein Problem  sich in Ruhe zurückzuziehen ,Außerdem wohnen bei uns noch Alex und Linda   Die beiden Fellknäule gehören Philipp und mir und sind super liebe  freche Katzen  Alex ist sehr verschmust und Linda extrem neugierig     Du musst dich um die beiden nicht kümmern  kannst sie gerne aber streicheln oder auch füttern falls wir mal nicht da sind   ,https://www.wg-gesucht.de/wg-zimmer-in-Aachen-Aachen.7392589.html
WG-Zimmer in bester Lage,3,10,340,Franzstraße,52064,264.0,-0.472175,False,False,Das Zimmer ist ab dem          frei       Das Zimmer ist    qm groß und ist zu einem Innenhof zur Ostseite gerichtet  Es ist abends schön ruhig und keine befahrene Straße ist zu hören      Regale  Schreibtisch und Bett können gegen einen Abschlag übernommen werden  Details klären sich dann per Absprache  Zum Zimmer gehört noch eine Schrankhälfte auf dem Flur  um weitere Sachen zu verstauen      Ein Kellerabteil steht auch zur Verfügung ,Die Lage ist top  Zum Hauptbahnhof und diversen Bushaltestellen  Alter Posthof  Miseroer  Theater  Aachen HBF  sind es nur   Minuten zu Fuß  wodurch man sehr schnell Richtung Heimat oder Uni unterwegs ist  Zur Uni  RWTH  fährt über den Ring alle   min ein Bus  Die FH ist mit dem Bus oder zu Fuß auch super erreichbar      In direkter Nähe der Wohnung  Richtung Altstadt  gibt es alle möglichen Einkaufsläden wie Aldi  DM  Rossmann  Mediamarkt und auch Bars und Imbissbuden  Auch das Kapuziner Karree mit dem Biergarten  Rewe  Kino und Bars ist schnell zu erreichen ,Deine Mitbewohner werden Lukas und Linh sein      Auf ein angenehmes und sauberes WG-Leben legen wir viel Wert  Unsere Wohnküche lädt perfekt zum Zusammenleben ein  Ab und zu kann es auch etwas lauter werden  Wir nehmen aber auch Rücksicht  falls einer mal mehr zu tun hat oder seine Ruhe braucht      Die Wohnung überzeugt außerdem mit einer gut ausgestatteten Küche  modernem Bad  Waschtrockner  Spülmaschine etc  Heißt  du brauchst eigentlich fast gar nichts mitbringen  Dafür wird dann ein Abschlag von       fällig ,Wenn dir die Wohnung gefällt  schreib uns gern eine Nachricht  in der du kurz etwas über dich erzählst  Wenn dann soweit alles passt  melden wir uns und besprechen alles weitere      Wenn du bis hierhin gelesen und immer noch Interesse hast  dann beginne doch deine Nachricht an uns mit einem  Ahoi         Wir freuen uns auf deine Nachricht ,https://www.wg-gesucht.de/wg-zimmer-in-Aachen-Aachen.7392589.html
Gemütliches WG-Zimmer zur Untermiete in der Nähe der Schanz,4,16,370,Hubertusstraße,52064,288.0,-0.9097,False,False,Da unsere Mitbewohnerin für ein Tertial ihres praktischen Jahres ins Ausland geht  suchen wir eine n Untermiet in für den Zeitraum vom      -                 Dein neues Reich wäre ein schönes  helles    m  großes Zimmer mit Dielenboden und hohen Decken  Das Zimmer wird möbliert vermietet mit Bett  Schreibtisch  Schrank  Kommode und Sessel      In der Wohnung sind außerdem ein Bad  Toilette  Küche und die drei Zimmer der anderen Mitbewohnis  Die Küche dient gleichzeitig als Gemeinschaftsraum  in dem schon viele Stunden verquatscht wurden  Die Küche ist komplett ausgestattet  auch mit einer Spülmaschine  Außerdem geht ein kleiner Balkon von der Küche  zum Innenhof ab      Unten im Keller haben wir auch ein Kellerabteil in dem Sachen gelagert werden könnten ,Unsere WG liegt in unmittelbarerer Umgebung vom Last Exit  für diejenigen  die sich in Aachen auskennen  Ansonsten ist man in    min am HBF  an der Schanz und in der Innenstadt  Die RWTH  Hauptgebäude  Super C  liegt ebenfalls ca     min fußläufig und   min mit dem Rad entfernt  Die KatHO und FH  je nach Gebäude  sind ca     min entfernt  Diverse Buslinien sind ab Annastraße  ca    min entfernt   Misereor  ca    min  oder Alter Posthof  ca    min  zu erreichen  An Einkaufsmöglichkeiten gibt es in der direkten Nachbarschaft verschiedene Bäcker  sowie DM  Rossmann  Aldi  Netto und Rewe    min   ein Edeka ist    min fußläufig  In unmittelbarer Nähe sind auch der Westpark und der Hangeweiher  mit Freibad  - die Lage lässt also absolut keine Wünsche offen ,Da unsere Mitbewohnerin für ein Tertial ihres praktischen Jahres ins Ausland geht  suchen wir für den Zeitraum von September bis Dezember eine n Untermieter in       In der WG bleiben Lea  die gerade ihre Promotion im Bereich Verfahrenstechnik macht  Tim  der irgendwas mit Medien studiert und Frederike  die ihre Masterarbeit in Energietechnik schreibt     Obwohl wir erst seit ein paar Monaten in dieser Konstellation zusammenwohnen  sind wir definitiv keine Zweck-WG und unternehmen regelmäßig schöne Dinge zusammen  wie z B  gemütliche Koch- und WG-Abende  In der WG gibt es viele verschiedene Interessen  wodurch man eigentlich immer eine Person findet  die bei Unternehmungen oder einem entspannten Kaltgetränk dabei ist  Aber auch für Probleme gibt es immer ein offenes Ohr und es ist uns wichtig  dass eine gewisse Vertrauensbasis herrscht  Natürlich respektieren wir aber auch die Privatsphäre der anderen oder wenn du mal deine Ruhe haben willst     Wir haben einen Putzplan  der nicht jederzeit dafür sorgt  dass man vom Boden essen kann  aber eine grundsätzliche Sauberkeit herrscht bei uns auf jeden Fall ,In den Nebenkosten sind Strom  Wasser  Fernwärme und Rundfunkgebühren enthalten       Wir sind keine Zweck-WG  Dementsprechend werden wir nur Nachrichten beantworten  die an uns persönlich gerichtet sind und die zu unserem Gesuch passen  ernsthaft   Wenn du also ein aufgeschlossener  rücksichtsvoller Mensch bist  der das WG  x  schon gelernt hat  melde dich gerne bei uns       Wir freuen uns dich kennenzulernen         Lea  Frederike  Tim   Lucie,https://www.wg-gesucht.de/wg-zimmer-in-Aachen-Aachen.7392589.html
