titel,bewohner,groesse,miete,strasse,plz,online_seit,sentiment,verbindung,verbindung_moeglich,zimmer,lage,wg_leben,sonstiges,link
Studentenzimmer in direkter Uninähe,11,20,265,Hainbuchenstraße,52074,0.02,-0.40675,True,True, We are renting to tenants that are planning to stay in Aachen for at least   years and are comfortable communicating in German or are improving their German  Internationals  Erasmus and Master students don t usually fulfill these two criteria       Die verfügbaren Zimmer sind jeweils zwischen    und    qm groß und befinden sich alle im ersten Stock des Hauses  Jedes Zimmer ist gemütlich möbliert mit einem Schreibtisch  Schreibtischstuhl  Bett inklusive Matratze  Spiegel sowie Kleiderschränken     Auf der Bewohneretage    OG  gibt es zwei frisch renovierte Bäder mit insgesamt zwei Toiletten und drei Duschen  Auf der   OG haben wir ein Büro mit Computer und Drucker  das allen zur Verfügung steht      Im Erdgeschoss findest du einen Gemeinschaftsraum mit Beamer für Filmabende oder Live-Übertragungen von Fußballspielen  einen Billardtisch  ein Klavier  einen ruhigen Lernraum  eine Theke mit Zapfanlage  ein Fernsehzimmer und eine Bibliothek mit vielen nützlichen Lernmaterialien aus verschiedenen Studiengängen      Im Untergeschoss gibt es eine große  voll ausgestattete Gemeinschaftsküche  eine Bartheke  einen Sportraum  einen Waschkeller mit jeweils zwei großen Trocknern und Waschmaschinen sowie ein weiteres Bad mit Toiletten ,Dank der hervorragenden Lage auf der Hörn befindet sich unser Haus in direkter Nähe zu dem Hauptgebäude  Audimax  Carl  Informatikzentrum  Bauingenieurgebäude  Uni-Gym und den Sportanlagen der RWTH sowie zum Westbahnhof  Auch der Campus Melaten ist nur wenige Minuten entfernt      Die Bushaltestelle  die etwa    m entfernt ist  bietet eine direkte Verbindung zur Innenstadt mit zahlreichen Einkaufsmöglichkeiten  Bars und Restaurants sowie zu den weiteren Uni-Gebäuden     Trotz der zentralen Lage liegt das Haus nicht an einer Hauptstraße  was es zu einem ruhigen Ort zum Lernen und Schlafen macht ,Wir sind das Corps Delta  Corps sind die ältesten Studentenverbindungen  die es heute gibt  und sie zeichnen sich durch ihr Toleranzprinzip und eine offene  freiheitliche Geisteshaltung aus  Das bedeutet  dass alle Studierenden  unabhängig von Nationalität  Herkunft oder Religion  bei einem Corps mitmachen können      Bei uns ist jeder RWTH-Student willkommen  egal welche Staatsangehörigkeit  soziale oder ethnische Herkunft oder Religionszugehörigkeit er hat      Ernst mit Lust gepaart  heißt bei uns Studentenart  Bei uns kommt das Feiern nie zu kurz  Wenn du nach dem Lernen gerne abends ein Bierchen in gemütlicher Runde trinken möchtest  findest du bei uns immer jemanden  der sich dazu gesellen mag  In unserem Haus ist immer etwas los      Wir unterstützen uns gegenseitig nicht nur im Studium  sondern auch in der Freizeit und bei allen alltäglichen Problemen  Wir achten aufeinander und lernen gemeinsam Soft Skills für das spätere Leben  Dabei legen wir großen Wert darauf  dass jeder sein Studium zügig und ordentlich abschließt       Bei uns findest du vielfältige Unterstützung - für die Studienplanung und die Vorbereitung auf Klausuren kannst du von der Erfahrung älterer Studenten und Mentoring-Programme bei uns profitieren      Weitere Informationen über uns findest du auf unserer Website     https   www corpsdelta de,Gerne zeigen wir dir in Person unser Haus und dein vielleicht zukünftiges Zuhause  Melde dich einfach per Nachricht oder telefonisch bei uns  und wir vereinbaren kurzfristig einen Besichtigungstermin  Telefonisch am liebsten nur zwischen   Uhr und   Uhr  Schreib uns am besten noch ein paar Zeilen über dich z B  was studierst du oder studieren möchtest  Was ist dir besonders wichtig beim Zusammenleben  Welche Hobbys und Interessen hast du      Falls du von weiter weg kommst  kannst du auch eines unserer Gästezimmer für eine unkomplizierte Übernachtung in Aachen nutzen      Wir freuen uns jedenfalls darauf  dich persönlich kennenzulernen ,https://www.wg-gesucht.de/wg-zimmer-in-Aachen-Aachen.7392589.html
Mitbewohner für 8er Studenten- WG gesucht,8,18,180,Krefelder,52070,0.02,-0.2284,True,True,Was wir euch bieten     Zimmer mit   qm bis   qm Wohnfläche  wahlweise teilmöbliert      Großes Gemeinschaftsbadezimmer    Duschen    WCs      Große gut ausgestattete Gemeinschaftsküche     Waschmaschine und Trockner     Gemütliche Gemeinschaftsräume zum Lernen und Beisammensitzen      In der Miete sind alle Nebenkosten enthalten  dazu zählen     Festnetz und Internet Flatrate     k Kabel      Satellitenempfang im Zimmer     Strom- und Heizkosten     Nutzung von Waschmaschine und Trockner ,Das Haus liegt in guter Lage  Aldi und Netto liegen fußläufig entfernt  Die zentralen Unigebäude sind in    Minuten zu Fuß erreichbar    Die Parkmöglichkeiten direkt am Haus sind gut und kostenlos  Das Aachener Fußballstadion  Tivoli  und ein Fitnessstudio sind ebenfalls zu Fuß erreichbar     In Hausnähe befinden sich außerdem der Aachener Stadtgarten und die Carolus Therme ,Wir sind eine Studentenverbindung  bestehend aus Studenten verschiedener Fachrichtungen und Semester  Wir unterstürzen uns gegenseitig beim Lernen oder anderen alltäglichen Dingen     Wenn du Lust auf eine gesellige und erlebnisreiche Studentenzeit hast  bist du bei uns genau richtig     Der Grill geht im Sommer selten aus und in unseren Gemeinschaftsräumen findet sich immer jemand  mit mit dem man Spaß haben kann ,Falls wir dein Interesse geweckt haben sollten  schreib uns eine E-Mail oder ruf einfach an     Wenn du uns schreibst  dann stell dich bitte kurz vor  Wer bist du  Woher kommst du  Womit beschäftigst du dich  wenn du mal nicht studierst  Was führt dich nach Aachen     Wir freuen uns dich kennenzulernen ,https://www.wg-gesucht.de/wg-zimmer-in-Aachen-Aachen.7392589.html
Mitbewohner für 8er Studenten- WG gesucht,8,18,180,Krefelder,52070,0.03,-0.2284,True,True,Was wir euch bieten     Zimmer mit   qm bis   qm Wohnfläche  wahlweise teilmöbliert      Großes Gemeinschaftsbadezimmer    Duschen    WCs      Große gut ausgestattete Gemeinschaftsküche     Waschmaschine und Trockner     Gemütliche Gemeinschaftsräume zum Lernen und Beisammensitzen      In der Miete sind alle Nebenkosten enthalten  dazu zählen     Festnetz und Internet Flatrate     k Kabel      Satellitenempfang im Zimmer     Strom- und Heizkosten     Nutzung von Waschmaschine und Trockner ,Das Haus liegt in guter Lage  Aldi und Netto liegen fußläufig entfernt  Die zentralen Unigebäude sind in    Minuten zu Fuß erreichbar    Die Parkmöglichkeiten direkt am Haus sind gut und kostenlos  Das Aachener Fußballstadion  Tivoli  und ein Fitnessstudio sind ebenfalls zu Fuß erreichbar     In Hausnähe befinden sich außerdem der Aachener Stadtgarten und die Carolus Therme ,Wir sind eine Studentenverbindung  bestehend aus Studenten verschiedener Fachrichtungen und Semester  Wir unterstürzen uns gegenseitig beim Lernen oder anderen alltäglichen Dingen     Wenn du Lust auf eine gesellige und erlebnisreiche Studentenzeit hast  bist du bei uns genau richtig     Der Grill geht im Sommer selten aus und in unseren Gemeinschaftsräumen findet sich immer jemand  mit mit dem man Spaß haben kann ,Falls wir dein Interesse geweckt haben sollten  schreib uns eine E-Mail oder ruf einfach an     Wenn du uns schreibst  dann stell dich bitte kurz vor  Wer bist du  Woher kommst du  Womit beschäftigst du dich  wenn du mal nicht studierst  Was führt dich nach Aachen     Wir freuen uns dich kennenzulernen      Das Zimmer ist beziehbar ab sofort ,https://www.wg-gesucht.de/wg-zimmer-in-Aachen-Aachen.7392589.html
🏘 girls only apartment /rooms for female studens   in center of Aachen. The best location in town!,3,20,490,monheimsalle,52062,0.07,0.6058,False,False,Free room  in a shared WG  -rooms  apartments central   Aachen              euro for   room    person include nebenkosten       not include electricity       Deposit -      euro per person       Kitchen     Toile     bathroom      All rooms are spacious  With the desktop  a bed   And Wardrobe   The kitchen is fully equipped including a washing machine      Long-term agreement     years minimum        Include City register       Not for  smokers                 Please write to us only if you have read our terms and everything is clear to you  That apartment just for girls       ,Best location of Aachen      ,Amazing apartment ,All dAy flexibility  ,https://www.wg-gesucht.de/wg-zimmer-in-Aachen-Aachen.7392589.html
Neugebaute Studentenzimmer in bester Lage,17,14,250,Lousbergstraße,52072,0.09,-0.79385,False,True,Wir bieten zum Beginn eines jeden Semesters wieder Zimmer für neue Studenten in Aachen an      Das Haus wurde kürzlich renoviert und um neue Zimmer erweitert  Diese haben eine Größe von ca     bis   m  und sind über drei Wohnetagen verteilt  Jedes Zimmer ist bereits komplett mit Bett  Schreibtisch und Schränken möbliert und verfügt über einen   Gbit Internetanschluss  Die Zimmer im Neubau sind zusätzlich noch mit Fußbodenheizung und bodentiefe Fenster ausgestattet      Auf jeder Wohnetage gibt es ein komplett neugebautes Badezimmer  welches  x wöchentlich durch einen Putzdienst gereinigt wird  Des Weiteren stehen Dir unser eigener Tresenraum für gesellige Abende und der große Garten  in dem im Sommer ein Pool aufgebaut wird  zur Verfügung  Unser großzügiges Wohnzimmer lädt zu gemeinsamen Filmabenden ein und auch der Kraftraum ist mit allem ausgestattet  was das Herz begehrt  In unserer frisch renovierten Küche lässt es sich hervorragend gemeinsam kochen      Das Einzugsdatum kann flexibel gewählt werden  Es ist nicht zwingend notwendig zum angegebenen Datum einzuziehen ,Unser Haus im schönen Aachener Lousbergviertel ist in jeder Hinsicht optimal gelegen  Aufgrund der direkten Nähe zu den wichtigsten Unigebäude  wie dem CARL  dem Audimax  dem Hauptgebäude und dem Super C können im Prinzip alle Wege zu Fuß zurückgelegt werden  Auch die Mensa Academica ist schnell erreicht      Ebenso liegt die Pontstraße  inoffizielle Ess- und Partymeile  in unmittelbarer Nähe unseres Hauses  sodass auch einer ausgelassenen Abendgestaltung nichts im Wege steht  Zusätzlich sind zahlreiche Supermärkte schnell erreichbar      Auch verkehrstechnisch ist unser Haus ideal gelegen  Die Autobahnauffahrt Laurensberg ist nicht weit entfernt  der Westbahnhof ist zu Fuß in    Minuten erreichbar und am Ponttor befindet sich ein Knotenpunkt des ÖPNV  wodurch man auch schnell in die anderen Teile von Aachen gelangen kann      Obwohl das meiste fußläufig erreichbar ist  liegt unser Haus nicht an einer Hauptverkehrsstraße  wodurch man vom typischen Stadtlärm wenig mitbekommt      Für Sportbegeisterte liegt das Sportzentrum der RWTH in geringer Entfernung  ebenso kann man auf dem Lousberg schnell ins Grüne starten ,In unserem Haus wohnen Studenten aller Fachrichtungen und Semester  Viel Wert legen wir auf ein intensives Gemeinschaftsleben  zu dem auch viele ehemalige Hausbewohner gehören  Mehrmals wöchentlich treffen wir uns zum gemeinsamen Sporttreiben  wie zum Beispiel Fußball  Volleyball oder eine Runde um den Lousberg joggen  Auch Grillabende und Partys sind fester Bestandteil unseres Zusammenlebens  Außerdem unternehmen wir regelmäßig gemeinsame Exkursionen und Ausflüge  bei denen wir quer durch die Republik reisen  Im aktuellen Semester werden wir gemeinsam nach Kiel fahren       Auch im alltäglichen Leben helfen und unterstützen wir uns gegenseitig  Zum Beispiel bietet die neu eingerichtete Küche einen hervorragenden Ort sich zu treffen und gemeinsam zu kochen  Natürlich wird daneben das Studium nicht vernachlässigt  Gemeinsames Lernen im großen Saal führt zum Erfolg  Hier können die älteren Semester den Jüngeren unter die Arme greifen  Die große Sammlung diverser Lernmaterialien ist dabei unverzichtbar ,Uns ist wichtig  dass wir Leute finden  die sich auch in unsere Gruppe integrieren wollen  Falls du eine Gemeinschaft suchst  die dich während deines Studiums und auch danach begleitet und unterstützt  bist du bei uns genau richtig      Du denkst  dass Du in unser WG-Profil gut hineinpasst und beginnst in Aachen dein Studium oder studierst sogar schon hier  Dann komm doch gerne mal auf eine Hausbesichtigung vorbei   Schreib uns einfach hier oder unter der Nummer  siehe Kontaktinformationen  eine Nachricht oder eine E-Mail an    in der du uns ein wenig über dich  deine Entscheidung für ein Studium in Aachen und was du dir von deiner Zeit in der Kaiserstadt erhoffst  erzählst      Du kannst dich auch gerne auf unseren Internetseiten über uns informieren  Hier findest du noch weitere Eindrücke von unserem Gemeinschaftsleben und unseren Veranstaltungen      https   www instagram com turnerschaft rheno borussia      https   www rheno-borussia com index,https://www.wg-gesucht.de/wg-zimmer-in-Aachen-Aachen.7392589.html
WG-Zimmer in bester Lage für Studenten,6,14,200,Hexenberg,52074,0.1,-0.673425,True,True, Nach Absprache auch früherer oder späterer Einzugstermin möglich      Wenn du in Aachen studierst und dabei Freundschaft  Spaß und Gemeinschaft nicht zu kurz kommen lassen willst  dann bist du bei uns genau richtig  Das Haus wird von der Studentenverbindung K D St V  Kaiserpfalz  unpolitisch  katholisch  nicht-schlagend  farbentragend  genutzt       Das gemeinschaftliche Zusammenleben steht bei uns im Vordergrund  Es wird zusammen gelernt  gekocht oder Sonstiges unternommen - natürlich kommt dabei auch das Feiern nicht zu kurz  Deshalb suchen wir Leute  denen ein aktives Zusammenleben und eine starke Gemeinschaft wichtig sind      Die freien Zimmer sind zwischen    und   m  groß und kosten zwischen     und       Pro Monat werden etwa     Nebenkosten fällig  Die Wohnungsbilder stellen eine Auswahl der Zimmer dar  Die Zimmer im Haus sind auf   Etagen mit jeweils   Zimmern verteilt      Neben der Wohnfläche stehen mehrere große Räume zur gemeinschaftlichen Nutzung zur Verfügung  Eine eigene Theke  ein großer Saal  Lernräume  eine große  voll ausgestattete Küche  zwei Terrassen  sowie ein Clubraum  Ausreichend Parkplätze sind auch vorhanden     Überdies stehen Waschmaschine und Trockner zur Verfügung ,Das Haus liegt in bester Aachener Lage von Verkehrslärm geschützt in absoluter Uni- und Zentrumsnähe auf der Hörn  Sämtliche wichtigen Unieinrichtungen  Hauptgebäude  Audimax  K rm n-Auditorium  Informatikzentrum  Campus Melaten  Uniklinik  sind bequem zu Fuß in weniger als    min erreichbar  Zur Mensa und zum Unisportplatz  Fitness-Center  Fußballplätzen  Beachvolleyball  Tennis  Laufbahn etc   sind es nur   min      In direkter Nähe zum Haus Dreizehnlinden befindet sich die Bushaltestelle  Am Weißenberg  der Linien        und     die alle    min direkt zwischen der Innenstadt  Elisenbrunnen Bushof  und dem Campus Melaten verkehren ,Wir sind eine katholische  nicht-schlagende  politisch neutrale Studentenverbindung und eine aktive Wohngemeinschaft  die viel miteinander unternimmt  Dazu gehören gemeinsame Abende an der eigenen Theke   Fahrten Ausflüge in ganz Deutschland  Seminare und Vorträge aus Forschung   Wissenschaft  selbstorganisierte Partys und vieles mehr      Auf dem Haus ist immer etwas los  denn die Bewohner und ihre Freunde füllen das Haus permanent mit Leben  Die gegenseitige Unterstützung im Studium steht für uns an oberster Stelle  Wir suchen deswegen Personen  die gerne mit anderen in Kontakt stehen und bereit sind Spaß in der Gemeinschaft zu erleben und sich in diese einzubringen ,Wenn du Interesse an einem Zimmer auf unserem Haus hast  katholisch getauft bist und ein Studium in Aachen beginnst oder schon studierst  dann melde dich hier auf WG-Gesucht oder schreibe uns eine E-Mail  in der du ein wenig über dich erzählst          Du kannst dich auch gerne auf unseren Internetseiten über uns informieren      http   www kdstv-kaiserpfalz de     Instagram  kaiserpfalz aachen     Hier findest du mehr Informationen über uns und zudem Eindrücke von unseren Veranstaltungen      Wir sind an längerfristigen Mietverhältnissen interessiert und können deswegen Praktikanten und Erasmus-Studenten nicht berücksichtigen     Nach Absprache ist auch ein früherer oder späterer Einzugstermin möglich   frag einfach nach ,https://www.wg-gesucht.de/wg-zimmer-in-Aachen-Aachen.7392589.html
"Schönes Zimmer in WG mit Garten, Dachterasse und Partykeller",10,12,185,Süsterfeldstr.,52072,0.15,-0.5805,True,True,   Attention Internationals and Erasmus Students  We are looking for tenants speaking german fluently and are planning to study in Aachen for at least   years          Wichtig  bitte schickt uns eine Mail an BA at Alania RWTH-Aachen de  Solche Mails haben normalerweise mehr Erfolg       Wir sind das Wohnheim Alania  das private Studentenwohnheim des christlichen Studentenvereins Alania-Breslau und der akademischen Damenverbindung A D V  Laetitia mit    Bewohnern auf vier Etagen verteilt und suchen einen neuen Mitbewohner  Jede Etage besitzt ihre eigene Küche und zwei Badezimmer  Außerdem ist auch ein Balkon für jeden zu erreichen  Wir bieten euch ein    m  Zimmer für     EUR Warmmiete  In jedem Zimmer ist eine Waschecke vorhanden ,Unser Wohnheim liegt zwischen dem Aachener Westbahnhof und dem Bendplatz  Somit ist es in fußläufiger Entfernung    Minuten  zum Audimax  dem Hauptgebäude und zum neuen Hörsaalgebäude  dem C A R L   Am Westbahnhof      m  besteht Anschluss zu zahlreichen Bus-Linien  Innenstadt sowie Campus Melaten  und zu den Regionalzügen Richtung Düsseldorf und Aachen Hbf      Auch Einkaufsmöglichkeiten sind mit dem Fahrrad oder zu Fuß gut zu erreichen  ALDI  LIDL  NETTO  REWE      Außerdem ist man in ein paar Gehminuten am Königshügel  Sportzentrum der RWTH mit Fußball  Beachvolleyball  RWTH-Gym etc    Zudem ist man relativ schnell am Lousberg und somit im Grünen          Auch für spontane Weihnachtsgeschenke bietet der Lindt und Bahlsen bei uns um die Ecke eine perfekte Einkaufsmöglichkeit ,Im Wohnheim leben zwei Studentenverbindungen  deshalb sind wir alles andere als eine Zweck-WG  Der freundschaftliche Aspekt und das gemeinsamme Zusammenleben wird bei uns groß geschrieben  Somit verbringen wir gerne Zeit in einem unserer Gemeinschaftsräume  inkl  Pay-TV   der Kneipe und dem Garten  Auch die Dachterasse bietet gute Möglichkeiten für Grillabende      Die Anbindung an das High-Speed Internet der RWTH ist selbstverständlich auch vorhanden     Bei uns im Wohnheim sind neben Erstsemestern und kurz vor dem Abschluss stehenden Studenten fast alle Studiengänge vertreten  sodass in diesem bunt gemischten Wohnheim jeder schnell Anschluss findet  Dadurch können Studienfragen meist auf dem Haus direkt beantwortet werden      Außerdem ist unser Wohnheim komplett selbstverwaltet  Daher solltest du auch Spaß daran haben ab und zu mal mit anzupacken wenn Renovierungsarbeiten oder Veranstaltungen anstehen ,Wenn wir dein Interesse geweckt haben  dann lies dir doch einfach mal unsere detaillierte Beschreibung über das Haus und das angebotene Zimmer unter  https   www alania-breslau de zimmer  oder unter https   www alania-breslau de  durch  Dort findest du auch weitere Informationen über das Leben auf dem Haus  die Alania und die notwendigen Kontaktdaten  um dich bei uns zu bewerben     BA at Alania RWTH-Aachen de    Es wäre uns vor allem wichtig dass du in deiner E-Mail ein bisschen was über dich erzählst  damit wir wissen wer du bist ,https://www.wg-gesucht.de/wg-zimmer-in-Aachen-Aachen.7392589.html
Studentenzimmer direkt auf dem Campus,10,15,200,Kruppstr,52072,0.15,-0.6494500000000001,True,True,Wir vergeben zum kommenden Semester Zimmer in ruhiger  zentraler Lage im Aachener Univiertel an  erfolgsorientierte  tatkräftige und motivierte katholische Studenten     Unsere Zimmer sind zwischen    und   m  groß und können auf Wunsch mit Schreibtisch  Kommode  Schrank und Bett teilmöbliert übergeben werden  Zum täglichen Leben steht Dir alles zur Verfügung  Das Haus hat eine geräumige Küche  zwei Waschmaschinen und zwei Trockner  Weiterhin verfügen wir über einen überschaubaren Garten mit Grill und Sitzgelegenheit  über eine Kellerbar mit Theke  einen Kicker und über einen Saal zum Lernen und Feiern  Ein gemütlicher Gemeinschaftraum mit Fernseher  PlayStation und dieversen Streamingdiensten  Netflix  Amazon Prime  Disney   lädt darüber hinaus stets zum Beisammensein ein ,Das Haus liegt in einer ruhigen Seitenstraße in perfekter Unilage  Sämtliche für Erstsemester wichtigen Einrichtungen wie bspw  Audimax und C A R L  der RWTH sind zu Fuß in weniger als   Minuten erreichbar  Ebenso liegen das Hochschulsportzentrum und die Mensa in unmittelbarer Nähe     Fußläufig erreichst Du in   Minuten den Westbahnhof  die Haltestelle Ponttor mit den wichtigsten Aachener Buslinien und verschiedenste Supermärkte  Auch die Pontstraße  mit ihren Bars und Restaurants  ist schnell erreichbar ,Als NICHTSCHLAGENDE Studentenverbindung sind wir ein großer Freundeskreis aus Studenten und Absolventen verschiedener Fachrichtungen  Wir greifen auf eine große Zahl Mitglieder aus den Top-Positionen verschiedenster Fachbereiche zurück  Hier erhalten wir sowohl finanzielle Unterstützung  als auch Zugang zu einem tollen und durch Freundschaft gepflegten Netzwerk  Du erhältst Hilfe beim Einstieg ins Studium und bei fachlichen Schwierigkeiten stehen Dir die höheren Semester zur Seite  Seien es private Probleme oder benötigte Lernunterlagen  Gegenseitig unterstützen wir uns aber nicht nur in unserem Studium  sondern unternehmen daneben auch viel miteinander  In der Freizeit grillen oder kochen wir zusammen  gehen Feiern und betreiben gemeinsam Sport  Es werden jedes Semester Partys  Exkursionen  Vorträge und Fahrten in andere Unistädte organisiert  Für die kommenden Jahren haben wir uns das Thema  Carbon Footprints auf die Fahne geschrieben  zu welchem wir eine breitgefächerte Reihe an Vorträgen und Ausflügen anbieten wollen      Die Mitgliedschaft ist mit dem Einzug nicht verpflichtend  du halt also genug Zeit  dir den Spaß erst einmal von außen anzuschauen      Wenn Du diesen Text gelesen hast  dann schreib mich bitte mit  Samuel an  damit wir unsere Anfragen besser ordnen können  Danke,Selbstverständlich kannst Du Dir bei Interesse das Haus ansehen und die anderen Bewohner näher kennenlernen  Es gibt regelmäßig Abende  bei denen wir Bewohner die Interessenten für neue Zimmer gerne kennenlernen würden  Zudem zeigen wir Dir gerne Stadt und Uni und können Dir  aufgrund der vielfältig vertretenen Fachbereiche  sicherlich die eine oder andere Frage zum Studium schon im Voraus beantworten      Besuche uns doch auch auf unserer Homepage     http   makaria org      Bei Fragen oder Interesse melde Dich gerne über WG Gesucht      Viele Grüße      Samuel,https://www.wg-gesucht.de/wg-zimmer-in-Aachen-Aachen.7392589.html
