titel,bewohner,groesse,miete,strasse,plz,online_seit,sentiment,verbindung,verbindung_moeglich,zimmer,lage,wg_leben,sonstiges,link
All-inclusive room in a shared flat at Theatre   Unlimited contract | Anmeldung possible | Inclusive community,2,15,750,Theaterplatz,52062,17.0,0.5295000000000001,False,False,Modern furnished Room in a shared apartment with the best views of the Aachener Dom and Theatre  with access to exclusive community areas        What does All-inclusive mean      - Utilities    - Electricity    - Super fast WiFi    - Furniture     - Access to community spaces    - Community events on site  Fitness  Food etc       - Mobile app to manage everything all in one place    - Discounts to local shops    -  Anmeldung  possible     Yes  this is all included in the price  The goal is to live as a community      Book now on our Space Portal    https   my pohahouse com      The Space Portal is where you can find and reserve all our currently available rooms and flats       Your Space     - Large bed     x        - Desk     - Closet and plenty of storage     - View of the neighbourhood right out your window     Shared Spaces     - Comfortable living area with couch    - Fully equipped kitchen with everything you need to cook and dine including high-spec appliances  dishwasher  stove  oven  exhaust fan and large fridge     - TV     - Shared bathroom for you and only   other person     Community Spaces     - Lounge Space  with view of the Cathedral     - Dining Room    - Terrace    - Study Room    - Laundry Room     Photo credits  HEJM Photo  POHA House,Location      Located in the heart of the city at Theaterplatz  this trendy location is surrounded by historic landmarks  cosy caf s  and restaurants       Bus  Posthof Station    min walk     Train  Aachen Central Station     min walk     Theater Aachen    min walk     Aachen Cathedral    min walk ,Flatmates     - How many  Including you   -  people total     - Who could they be  They re either a young professional or student eager to make friends with you      NOTE  We also have an all-female identifying or non-binary flat     Shared Spaces     - Comfortable living area with couch    - Fully equipped kitchen with everything you need to cook and dine including high-spec appliances  dishwasher  stove  oven  exhaust fan and large fridge     - TV     - Shared bathroom for you and only   other person,Main Terms     Flexible unlimited contract with a minimum length of   months     Deposit is equal to   months  rent     One time reservation fee  deducted from the first month s rent ,https://www.wg-gesucht.de/wg-zimmer-in-Aachen-Aachen.7392589.html
Großes Zimmer mit Empore und Heimkino in 3er WG 🏳️‍🌈,3,20,549,Rudolfstraße,52070,17.0,-0.599275,False,False,Das Zimmer  und die gesamte WG  zeichnet sich durch seine    m hohen Decken aus  die auch Platz für eine  qm große Empore schaffen  Damit kannst du zum Beispiel dein Bett räumlich getrennt von deinem Arbeits- und Wohnbereich halten  und hast einfach noch viel mehr Platz als die   qm     Zwei große Fenster nach Osten sorgen für viel Licht über den ganzen Tag  Da die Fenster in den Innenhof zeigen  hast du auch wenig Lärm      Die WG hat weiterhin eine große  gut ausgestattete Küche mit Esstisch und Sofa  und ein Badezimmer mit Badewanne      Im Innenhof hast du eine sichere Möglichkeit  dein Fahrrad abzustellen  Falls du ein Auto hast  ist es auch möglich  dort einen Parkplatz zusätzlich anzumieten ,Direkt vor der Tür befindet sich der Rehmplatz  der einen Basketballkorb  Tischtennisplatte und einen schönen Ausblick bereitstellt  Die Wohnung befindet sich zwischen Jülicher Straße und Adalbertsteinweg in direkter Nähe zum Kaiserplatz  Bushof etc   unsere Straße ist dafür aber sehr ruhig      Direkt um die Ecke befindet sich der türkische Supermarkt Aksa  bei dem man viel frisches Gemüse kriegt  und auch ein Penny und der Rewe im Aquis sind in wenigen Minuten zu erreichen  Mit dem Kaiserplatz und Bushof hat man auch beste Anbindung an den ÖPNV ,Wir verbringen ein großen Teil unseres Tages zusammen  ob beim gemeinschaftlichen Kochen  Gesellschaftsspielen  bei ausgedehnten Diskussionen in der Küche oder einfach wenn man nach Feierabend kurz Dampf ablassen möchte  Ansonsten gehen wir öfters zusammen essen  ins Kino  auf Konzerte oder zum Sport  am liebsten mit Freund innen        Deine zukünftigen Mitbewohner innen sind      Till     Jahre  arbeitet Vollzeit als Koch  meistens nachmittags bis in die Nacht hinein  sodass er erst spät abends zuhause ist  Nach Feierabend ist er dafür noch für alle Späße zu haben  egal ob ein Mitternachtssnack oder gemeinsame Video- und Gesellschaftsspiele      Tjalde     Jahre  studiert Informatik  arbeitet in einem Aachener Startup und ist auch sonst an Open-Source-Projekten und modernen Programmiersprachen interessiert  In seiner Freizeit ist Tjalde immer up-to-date mit neuen Releases von ihren Lieblingsmusiker innen  Serien oder Indiegames und -filmen ,Wir sind für  fast  alle Arten von Menschen  studierend  in Ausbildung oder berufstätig  jung oder alt  was auch immer  offen  so lange das Miteinander passt  Falls du dich beim Leben in unserer WG siehst  schreib uns gerne eine Nachricht und stell dich kurz vor  Wir würden dich dann recht bald zu einem Kennenlernen in Person einladen  Damit wir wissen  dass du diese Anzeige auch gelesen hast  erwähne bitte das Wort  Käsekuchen  in deiner Nachricht      Ich würde meinem Nachmieter in gerne meinen Anteil an der WG-Ausstattung und bevorzugt auch Teile der Einrichtung meines Zimmers weiterverkaufen      Das Einzugsdatum ist um ein paar Wochen flexibel ,https://www.wg-gesucht.de/wg-zimmer-in-Aachen-Aachen.7392589.html
Wunderschönes WG-Zimmer in Aachen abzugeben,2,15,380,Trierer,52078,18.0,-0.6015,False,False,Das ca    m  große Zimmer befindet sich in einer ca    m  Wohnung in der sich ein weiteres Zimmer Bad und Küche befinden     Die Wohnung befindet sich im Dachgeschoss eines Mehrfamilienhauses nahe des Bahnhofes Rothe Erde      Es gibt zwar einige Schrägen aber das macht die Wohnung auch gemütlich  Der Platz kann jedoch durch die Höhe von ca      m gut genutzt werden     Außerdem sollen einige Möbel  wie beispielsweise der Sessel  der Kleiderschrank  der Schreibtisch in der WG bleiben  Dazu kommt die Waschmaschine  Insgesamt würde ich dafür      als Abschlagssumme nehmen      Die Miete entspricht Warmmiete mit Strom und Internet ,Einkaufsmöglichkeiten sind ca    Minuten von der Wohnung entfernt und durch dem Bahnhof ist der Weg in die Stadt nicht weit  Auch Busse fahren regelmäßig und die Natur ist nicht weit weg  Innerhalb von    Minuten kommt man in einen Park mit Schrebergärten und auch das Frankenberger Viertel mit vielen Restaurants  Bars weiteren Einkaufsmöglichkeiten ist nur einen Katzensprung entfernt ,Deine neue Mitbewohnerin ist Ceyda  sie ist    Jahre alt  Sie studiert an der katho Soziale Arbeit und engagiert sich im ehrenamtlich an der Hochschule  Sie macht gerne Sport  geht laufen und zum Kickboxen      In unserem WG-Alltag haben wir uns öfter spontan einen Kaffeeplausch gemacht und uns über Gott und die Welt unterhalten  Wir sind auch öfter zusammen laufen gegangen oder auch wenn es passte zusammen zur Uni gelaufen  Aber das ist natürlich kein muss      Es wurde immer auf Sauberkeit geachtet und insgesamt ist es keine Party-WG sondern eher etwas ruhiger ,Stell dich doch gerne bei Interesse an diesem Zimmer ein wenig vor  damit wir dich auch kennenlernen können ,https://www.wg-gesucht.de/wg-zimmer-in-Aachen-Aachen.7392589.html
Sonnige WG im Frankenberger Viertel,3,13,343,Oppenhoffallee,52066,18.0,-0.7451000000000001,False,False,Dein zukünftiges Zimmer ist   qm groß und durch ein großes Fenster  mit Rollo  hell  freundlich und mit Blick auf die Oppenhoffallee  Der Boden des Zimmers ist mit hellem Parkett ausgelegt  Gemeinsam mit einer neuen  gut ausgestatteten Küche  Duschbad  mit Fenster  und einem langen Flur ist es das kleinste Zimmer einer Dreier-WG im dritten Obergeschoss      In der Wohnung und in der Nachbarschaft ist es relativ ruhig  Fenster und Türen sind gut isoliert  Die restliche Wohnung ist ebenfalls mit Parkett bzw  in Bad und Küche mit Fliesen ausgestattet und ist insgesamt sehr gepflegt  Im Flur ist Platz für deine Schuhe und Jacken  Wir haben ein eigenes Kellerabteil und eine eigene Waschmaschine  ebenfalls im Keller  Im Hof gibt es eine ebenerdige  überdachte Abstellmöglichkeit für dein Fahrrad  Im Haus wohnen überwiegend nette StudentInnen ,Unsere WG liegt im schönen studentischen Frankenberger Viertel      Neben dem Frankenberger Park und der Burg laden zahlreiche Kneipen und Caf s zum Verweilen ein  Direkt um die Ecke hat vor kurzem ein großer Rewe  ein DM  und ein Nobis eröffnet  Fußläufig erreichst du auch Alnatura  Netto und weitere Bäckereien  Außerdem ist der Oecher Eistreff  der beste Eisladen Aachens  nur   min  entfernt        Direkt vor der Haustür befindet sich die Haltestelle Viktoriaallee  von der aus alle   Minuten ein Bus Richtung Innenstadt      Min  und Zentralcampus Melaten Uniklinikum           Min  fährt  Alternativ bietet sich noch die Haltestelle Josefskirche    Gehminuten  an  Der Bahnhof Rothe Erde  mit Anschluss an den Regionalverkehr  liegt ca     Gehminuten entfernt  der Hauptbahnhof    Min      Wir wohnen nun schon seit einiger Zeit hier und uns gefällt es immer noch sehr gut   ,Wir  das sind Levin  Rebecca und Paula      Da Rebecca im WiSe ein Auslandsemester machen wird  suchen wir jetzt nach einer ZwischenmieterIn für ihr Zimmer       Deine neuen MitbewohnerInnen werden Levin und Paula sein       Paula      studiert Geowissenschaften  Sie macht gerne Sport  also geht Bouldern  macht Yoga oder fährt Rennrad  Mit ihrer Nähmaschine schneidert sie gerne Klamotten  Außerdem zeichnt sie gerne  kümmert sich liebevoll um unsere Pflanzen oder trifft sich mit FreundInnen  am liebsten im Sommer auf nen Bierchen oder Aperölchen im Park     Ansonsten kocht Paula gerne und viel  Meistens veganes Zeugs  was aber nicht heißt  dass du auch Vegetarier Veganer sein musst       Levin      macht super gerne  als Ausgleich zu seinem dualen Studium zum Physiotherapeuten  Sport  Ansonsten hört er viel Musik  von Post Malone über The Weekend bishin zu ABBA ist alles dabei   guckt gerne Fußball und verbringt viel Zeit mit seinen Freunden  sei es beim Spieleabend  beim Feiern oder auch einfach im Park  Außerdem kocht Levin gerne und gut  weshalb wir auch oft abends zusammen Zeit in der Küche beim Kochen verbringen       Wir finden es schön  wenn man in der WG auch etwas voneinander mitbekommt  also nicht aneinander vorbei lebt und sich nur die GEZ teilt   Da unsere Küche zumindest ein bisschen Platz bietet  gibt es dafür auch genügend Raum  Dass jeder trotzdem mal für sich allein ist  versteht sich von selbst  Zusammen haben wir immer gerne gekocht  Sport gemacht  sind Eis essen gegangen oder haben Freizeit miteinander verbracht       Rücksichtnahme  Sauberkeit und Verantwortungsübernahme für die Gemeinschaftsräume sind uns wichtig  Beim Putzen hat bisher jeder selbstständig seinen Teil übernommen und wir würden uns freuen  wenn das auch so bleiben könnte ,Die Möbel  die auf den Fotos von Rebeccas Zimmer zu sehen sind  wird sie alle für dich da lassen  Auch ihren Beamer und Schallplattenspieler kannst du natürlich benutzen  Über die Ein- und Auszugsdaten können wir auch gerne nochmal quatschen  vor allem das Auszugsdatum ist relativ flexibel      Wenn du Lust hast einige Zeit bei uns zu wohnen und tatsächlich bis hier hin gelesen hast  scheinst du ja durchaus interessiert und dann freuen wir uns  von dir zu lesen      Schreib uns doch gern ein bisschen was über dich       Wir freuen uns auf deine Nachricht         Levin  Paula und Rebecca,https://www.wg-gesucht.de/wg-zimmer-in-Aachen-Aachen.7392589.html
Studentenzimmer in bester Lage,10,20,250,Försterstraße,52072,19.0,-0.5519000000000001,True,True,In diesem Sommersemester sind drei Zimmer verfügbar     Zwei der Zimmer sind im    OG gartenseitig gelegen  Beide verfügen - wie alle WG-Zimmer im Haus - über ein Waschbecken mit Spiegel  Das mit      qm größere der beiden Zimmer hat Zugang zu einem kleinen Balkon auf der Gartenseite  Das kleinere Zimmer hat eine Grundfläche von    qm    Das dritte verfügbare Zimmer ist im    OG auf der Straßenseite des Hauses und ist    qm groß    Die dazugehörige Küche  WC und Dusche im    Stock werden zusammen mit fünf Mitbewohnern genutzt      Im Mietpreis sind alle Nebenkosten  WLAN  eine wöchentliche Reinigung der Gemeinschaftsräume und Verbrauchsartikel enthalten  Selbstverständlich verfügt das Haus über voll ausgestattete Küchen  Waschmaschine und Trockner ,Vom Haus aus ist das Ponttor fußläufig in fünf Minuten zu erreichen  zu Mensa und Audimax dauert es ebenfalls nur wenige Minuten  Das Haus liegt am Fuß des Lousbergs in einer der schönsten Wohngegenden unserer Kaiserstadt  Die nächste Bushaltestelle  Bendplatz  ist nur drei Minuten entfernt  ebenfalls ist der Westbahnhof innerhalb von zehn Minuten schnell zu Fuß erreicht  Wie oben erwähnt  ist der ÖPNV-Knotenpunkt am Ponttor auch direkt um die Ecke     Einkaufsmöglichkeiten bieten die nahe gelegenen Supermärkte  Netto  Rewe  Lidl  und auf der Pontstraße um die Ecke warten kulinarische Köstlichkeiten und am Abend ist es zu den nächsten Clubs und Bars auch nicht weit     Zum Abschalten  wie auch zum Sport treiben  bietet sich der Lousberg in unmittelbarer Nähe an ,Wir sind derzeit acht Studierende der RWTH und der FH Aachen und studieren querbeet in verschiedensten Fakultäten  Von angewandter Geographie bis Physik findet sich immer ein Ansprechpartner für den erfolgreichen Studieneinstieg     Als Mitbewohner warten auf Dich entspannte Abende in unserem Garten und unseren Gemeinschaftsräumen  wo wir gerne zu gemeinsamen Spielabenden  Spikeball  Kochen  Partys und mehr zusammenkommen     Gerne erkunden wir die Stadt mit dir oder zeigen dir unsere Lieblingsorte  -restaurants  -bars und -sportarten in  unserem  Aachen     Neben dem Studium engagieren wir uns in der Unitas Aachen und planen Veranstaltungen wissenschaftlicher oder geselliger Art  etwa Vortragsabende  Ausflüge oder Kneipen  wie die festlichen Abende in studentischer Tradition heißen     Unsere WG befindet sich im Haus der Unitas Aachen  das bedeutet jedoch nicht  dass du sofort Mitglied im Verein werden musst - eine gewisse Offenheit gegenüber dem Verbindungsleben sollte aber für ein positives WG-Klima vorhanden sein ,Wir suchen einen aufgeschlossenen  netten Studenten der Teil unseres WG-Lebens werden möchte     Du beginnst hier in Aachen dein Bachelorstudium     Dann schick  uns eine Nachricht und stell  dich kurz vor  Danach können wir einen Besichtigungstermin vereinbaren  Solltest du eine längere Anreise haben  kannst du auch in unserem Gästezimmer übernachten     Nach Absprache ist ein flexibler Einzugstermin möglich       Als Studentenverbindung sind wir Mitglied des Unitas-Verbands  in dem katholische Männer und Frauen  ungeachtet ihrer Nationalität oder Herkunft Mitglied werden können  Als solche lehnen wir politische Extreme  das akademische Fechten und das Farbentragen in Bändern und Mützen ab     Unser Verein in Aachen ist eine Männerverbindung  auf Verbandsebene nehmen wir jedoch regelmäßig an Veranstaltungen mit unseren Frauenverbindungen  etwa aus Bonn  Köln oder Marburg  teil      Mehr über uns findest du auf unserer Homepage oder bei Instagram      http   reichenstein unitas org     https   www instagram com unitasreichenstein ,https://www.wg-gesucht.de/wg-zimmer-in-Aachen-Aachen.7392589.html
Gemütliches WG-Zimmer in fantastischer Lage zur Mensa/Uni und Innenstadt,3,26,493,Roermonderstraße,52072,19.0,-0.6408,False,False,Wir sind eine WG mit super offenen Türen  Die Wohnung umfasst insgesamt   Zimmer  jeweils eines dieser Zimmer wird an einen Mitbewohner vermietet  Das kleinere Zimmer gehört Vico  Die zwei großen Zimmer  jeweils versehen mit einer Empore  sind aufgeteilt in ein privates WG-Zimmer oben und einen Gemeinschaftsbereich unten  Der Gemeinschaftsbereich in deinem Zimmer wird als Wohnzimmer genutzt  Der Gemeinschaftsbereich im anderen Zimmer  bei Fabian  ist das Esszimmer      Dein Zimmer ist somit in zwei Ebenen aufgeteilt  die mit einer Treppe Leiter verbunden sind  Die Dachschrägen inkl  Dachfenster und der hölzerne Dachträger machen das Zimmer sehr gemütlich      Mit deinem Einzug nutzen wir die Gelegenheit  um den Wohnzimmerbereich komplett neu einzurichten  Da sind unserer gemeinsamen Kreativität keine Grenzen gesetzt  das Zimmer in eine Wohlfühloase zu verwandeln      Ziehst du in unsere WG  erwarten dich in unserem Wohnheim neben einer sehr korrekten und verständnisvollen Hausverwaltung auch ein sehr hilfsbereiter und netter Hausmeister  der uns bei allen unseren Vorhaben  vom Heizungsentlüften  über das Austauschen von Dichtungen oder Lampen  bis hin zum Aufhängen von Bildern oder Vorhängen oder dem Montieren von Regalen  unter die Arme greift ,Du erreichst alles in knapp   -   min      Wir haben eine gute Anbindung zur Stadtmitte  zur Bushaltestelle    min Fußweg  und zum Bahnhof  Aachen-West     min Fußweg   Man kommt innerhalb von   Minuten ins Grüne  indem man sich zum Lousberg begibt  Dort gibt es schöne Möglichkeiten zum Spazieren oder sogar Joggen  In der Mensa Academica  am C A R L   Audimax  Super C  Informatikzentrum ist man in    -   min  Und auch den Bäcker  bei dem wir gefühlt jeden    Tag Brote holen und der sogar sonntags bis    Uhr geöffnet hat  erreichst du in weniger als   min zu Fuß  Auch Supermärkte sind ebenso nah gelegen      Es steht dir der hauseigene Waschkeller rund um die Uhr  inklusive telefonischem   h-Notdienst  zur Verfügung  Dieser schließt direkt an unseren Fahrradkeller an  Aber nicht nur dein Fahrrad kann sicher geparkt werden  sondern auch dein Auto  Es ist möglich  sich über die Hausverwaltung einen Stellplatz für sein Auto im Innenhof anzumieten  Analoges gilt für einen Abstellraum im Kellergeschoss  All dies wird  wie auch unsere Wohnung  komfortabel direkt über unseren Aufzug erreicht ,Das A und O in unserem WG-Leben sind Respekt und Rücksichtnahme  Das bedeutet insbesondere für die Nutzung der Gemeinschaftsbereiche  Ess- und Wohnzimmer   die Bedürfnisse des Zimmerbewohners zu berücksichtigen  An dieser Stelle gilt ganz klar  Kommunikation ist bei uns alles  Man kann über alles reden     Für mehr Privatsphäre kann man sich bei Bedarf einen Vorhang vor das Geländer der Empore hängen  wie es im anderen Zimmer auch schon geschehen ist  und sich so eine Möglichkeit schaffen  die  Türe hinter sich schließen zu können        Ordnung und Sauberkeit sind für uns definitiv keine Fremdwörter und gehören mit zu unserem WG-Leben  Da insbesondere unsere Nutzflächen  wie z  B  in der Küche  sehr effizient gestaltet sind  gilt bei uns stets das Credo   Verlasse deinen Arbeitsplatz immer so  wie du ihn vorfinden möchtest   So bleibt alles immer schön sauber und aufgeräumt      Unsere Lebensmittel haben wir bislang geteilt  so hatten wir z  B  keine Aufteilung im Kühlschrank   wir wären diesbezüglich aber offen für deine Vorstellungen und würden uns auf dich einstellen      Wir sind gerne mal für einen gemütlichen  Spiele- Abend zu haben  Partys hingegen gehören nicht zu unseren Lieblingsbeschäftigungen  Auch kann man abends gemütlich den Tag auf unserer gemeinschaftlich genutzten Dachterrasse ausklingen lassen      Unter der Woche findet man unsere WG mittags auch gerne mal zusammen in der Mensa      Nun aber konkret zu uns  Wir sind Fabian und Vico     Fabian      ist Informatikstudent und nebenbei begeisterter Musiker  Er spielt in diversen studentischen Ensembles und Orchestern mit  Wenn ihm zwischen all seinen Vorhaben noch Zeit dazu bleibt  dann kocht er auch gerne mit und für die WG  Ein vielleicht ein etwas zu großes Hobby von ihm sind absolut unlustige Dadjokes und Wortwitze     D    Vico      studiert Materialwissenschaften und spielt leidenschaftlich Hockey  Zusätzlich spielt er Kontrabass im Uniorchester und ist daher zeitlich stark eingebunden  Auch für eine Partie Schach ist er immer zu begeistern  Fabians Witze machen ihm mittlerweile wirklich zu schaffen      ,In unserem Wohnheim sind ausschließlich Studierende wohnberechtigt      Du bist also Student in  Du bist entspannt  kommunikativ und offen  Du bist spontan und kompromissbereit      Dann schreib uns gerne  D und stelle dich dabei kurz vor       Bis dahin - wir freuen uns von dir zu hören     Vico und Fabian,https://www.wg-gesucht.de/wg-zimmer-in-Aachen-Aachen.7392589.html
Nachmietersuche! 1 Zimmer verfügbar ab 1. August 2024 in einer 2-Personen-Wohnung,2,22,477,Rudolfstr.,52070,20.0,0.0817,False,False,Dein Zimmer hat ein Bett mit einer großen Matratze  einen Schreibtisch  einen Spielesessel  einen Kleiderschrank  Regale  Kleiderständer  ein Sofa  einen Liegestuhl  Teppiche und eine Mikrowelle  Außerdem scheint den ganzen Tag über die Sonne in dein Zimmer  Aber es hat einen Vorhang  der dir hilft  nachts zu schlafen       Gemeinsame Küche mit einem großen Kühlschrank    Etage   in dem du deine Lebensmittel aufbewahren können  Abstellraum  Herd und Spülbecken       Gemeinsames Bad mit Dusche  WC und Waschmaschine        English version       Your room has a bed with a big mattress  desk  gaming chair  wardrobe  shelves  cloth racks  sofa  laying chair  carpets  and microwave  Moreover  the sun is always shining in your room the entire day  But it has a curtain which helps you sleep at night       Shared kitchen with a large fridge which   layer will be yours to store your groceries  storage  cooker  and sink       Shared bathroom with shower  toilet  and washing machine ,Die Wohnung liegt in der Nähe des Hansemannplatzes und des Kaiserplatzes und ist mit mehreren Bussen gut an das Stadtzentrum angebunden  Zum Elisenbrunnen sind es nur    min zu Fuß und mit dem Bus   min  Das Highlight ist die Aussicht aus der Wohnung  da das Zimmer im obersten Stockwerk liegt  Wie Sie auf dem Foto der Wohnung sehen können  ist dies ein sehr guter Ort zu wohnen  Außerdem befindet sich der Asialaden direkt vor der Wohnung und Penny ist nur   Minuten zu Fuß entfernt        English version       Located near Hansemannplatz and Kaiserplatz with proximity to the city center by taking several buses  Just    min walk to Elisenbrunnen and by bus within   min  The highlight is the view from the apartment because the room is on the top floor  As you can see from the photo of the apartment facility  here is a very good spot for living  Moreover  the Asian shop is just in front of your apartment and Penny is just   minutes  walk ,Du wirst mit   Jung leben  und er ist der Hauptwohnsitz  Er ist Rifelo aus Indonesien  er hat vor mir hier gelebt  Er ist dabei  seinen Bachelor-Abschluss  Er ist ein netter Mensch und sehr gut über die Wohnung organisiert  Wir leben getrennt in unserem Zimmer  aber wenn wir uns treffen  können wir über das Leben und andere wichtige Dinge reden        Wir kochen getrennt und haben getrennte Utensilien  die du von mir zum niedrigsten Preis kaufen können  wenn du willst  Wir haben eine Reinigung und Müllentsorgung Kalender jede Woche  um den Ort immer sauber zu halten        English version       You will live with   guy  and he is the main resident  He is Rifelo from Indonesia  he has lived here before me  He is doing his bachelor s degree  He is a nice person and very well organized about the apartment  We live separately in our room but when we meet each other we can talk about life and some relevant stuff        We cook separately and separate utensils which you can buy from me at the lowest price if you want  We have a cleaning and trash disposal calendar each week to keep the place always clean ,Der Grund  warum ich von hier weggezogen bin  war  dass ich ins Studentenwohnheim ziehen wollte      Wasser  Strom und WIFI sind im Preis inbegriffen  außer den Rundfunkgebühren GEZ  die du dir mit Rifelo teilst       Du kannst am     Mai einziehen  Ihr Mietvertrag beginnt also am    Mai        -Bett   Matratze   Kopfkissen   Decke     -Kleiderschrank     -Schreibtische     -Spielesessel     -Kleiderschrank     -Regale     -Kleiderständer     -Sofa     -Liegestuhl     -Teppiche     -Mikrowelle     -Ventilator        Du erhältst einige kostenlose Möbeln  wie     -Küchenutensilien wie Pfanne  Schüssel  Teller  Löffel  Gabel  Messer     -Kaffeeset wie Wasserkocher  Cruncher  Frenchpresso      Wenn du Fragen hast oder die Wohnung erst einmal besichtigen wollen  kannst du mir gerne über Whatsapp schreiben        ---- -------        English version      The reason I moved away from here was because I wanted to move into student accommodation      Water  electricity and WIFI are included in the price  except for the broadcasting fees GEZ  which you share with Rifelo       You can move in on May  st  Your rental contract therefore starts on May           -bed   mattress   pillow   blanket     -Wardrobe     -Desks     -playing chair     -Wardrobe     -Shelves     -clothes racks     -sofa     -Reclining chair     -carpets     -Microwave     -Fan        Du you will receive some free furniture  such as     -Kitchen utensils such as pan  bowl  plate  spoon  fork  knife     -coffee set such as kettle  cruncher  Frenchpresso      If you have any questions or want to visit the apartment first  you are welcome to write me via Whatsapp,https://www.wg-gesucht.de/wg-zimmer-in-Aachen-Aachen.7392589.html
