titel,bewohner,groesse,miete,strasse,plz,online_seit,sentiment,verbindung,verbindung_moeglich,zimmer,lage,wg_leben,sonstiges,link
"Alexanderstrasse 63/65 (3) modern & bright flat, full furnished room with 1 Gbit/s LAN & WiFi , full equipped kitchen, 2 bathrooms, washing machine, bicycle storage room, just 6min walk to RWTH SUPER C, 1 min walk to central station",4,16,465,Alexanderstraße,52062,48.0,-0.10017500000000001,False,False,New refurbished flat with all u need      Full equipped modern kitchen with energy saver fridge   freezer  microwave  dishwasher  oven and electric cooking field  no induction  with kitchen hood  outgoing air    dishes and cutlery  cookware  cupboards with place to store your food     two new bright bathrooms with toilet  shower  washbasin and storage    one with window  the other one with air out ventilator     full equipped  bright room     bed with matress and matresscover  desk  chair  wardrobe  window can be opened     LAN port in your room with max        mbit s        central WiFi     washing machine also included -no extra fee-     lockable cabin in the basement  also place to park your bicycle      rd floor in a quiet house,central in Aachen City Center     min walk to Aachen Bushof   Busstops arround    quiet street with less traffic      min walk to RWTH super c    Netto and lot other shopping Center near by,International guys  all with checked and registered passport   visa     No illegal people or workers     Student Community,Info zum Vertrag und dem Ablauf der Anmietung     Der Vertrag wird unbefristet mit einem Jahr Kündigungsverzicht angeboten     Falls ein vorzeitiger Auszug ansteht kann ein passender Nachmieter gesucht   gestellt werden der den Vertrag übernimmt  Sollte kein Nachmieter gestellt werden ist die Vertragslaufzeit einzuhalten und bist zum Ende des Kündigungsverzicht zu zahlen  Eine Kündigung muss grundsätzlich immer erfolgen  unabhängig des Kündigungverzichts     Der Mietpreis ist fix und wird für den vereinbarten Zeitraum nicht angehoben     Die Strom  und Heizkosten werden mit     includiert  Leider sind die Kosten für Gas und Strom derzeit nicht in die Zukunft zu sichern  Sollten die Kosten höher sein als die     sind diese nachzuzahlen     Eine Reservierung ist möglich durch die Zahlung von       KEINE GEBÜHR        Die Anzahlung wird zu      angerechnet  Bei Einzug wird die erste Miete und die Kaution sofort fällig  dann erst erfolgt die Schlüsselübergabe  Die Kautionszahlung wird im Mietvertrag bestätigt und bei Auszug erstattet wenn keine Schäden oder Nachzahlungen zu erwarten sind  Bei Einzug wird auch eine Mietbescheinigung ausgestellt die zum Anmelden bei der städtischen Meldebehörde benötigt wird  Wohnungsgeberbescheinigung      Bei ernsthaftem Interesse wird ein Vertragsentwurf nach zusenden des Personalausweis  vorbereitet  Dieser wird dann personalisiert an den Interessent- in zur Durchsicht gesendet  Und falls keine weiteren Fragen aufkommen  dann erst möchte ich die Anzahlung haben  Diese beträgt     -  und ist entweder bei der Besichtigung zu zahlen oder per Überweisung auf ein Konto bei einer deutschen Bank       kein Western Union oder Money Gramm  Hier sind meist Betrüger am Werk  Oftmals werden Kautionszahlungen verlangt  die auf ein nicht verifiziertes Konto    gesendet werden    sollen und dann ist das Geld leider weg  Bei mir wird es ein deutsches Konto  bei dem der Zahlungsweg nachvollziehbar bleibt     So lange die Anzeige online ist besteht die Möglichkeit diese zu mieten  es wird umgehend nach der Reservierung deaktiviert  Bei Vertragsunterzeichnung ist der gültiger Ausweis ggf  Visa vorzuweisen      XXXXXXXXXXXXXXXXXXXXXXXXXXXXXXXXXXXXXXXXXXXXXXXXXXXXXXXXXXXXX     Some information about the contract and the procedure     The contract is minimum   year with option to stay longer     If you must move out earlier you can find another tenant who stay there  Worst case   you must pay till end of the first year  After the first year we can talk about the extension     You must terminate the contract in every case before moving out  latest   month before  The rent included all sidecosts  water  wastewater  trash and also heating and electric  The heating  new energy saving gas heating for warm water and heating  and electric is included the rent with     monthly  By increasing prices for gas and electric i can t fix that price  Regulare it will cover  but it depense on the providers price and also your consumption  If the price is more than     monthly you have to pay that difference     If you will rent the room  I need your passport and visa  if you are not from europe   I will prepare a contract in your name  send it by email to you to read all  If you agree with all you have to pay a deposit  The deposit is      per room  Payed cash when you move in and got your keys  If you can t come and visit the house but you will rent it  I can do a reservation on your room  I need      send to my official german bank account  No MoneyGram or Western Union  PayPal will also works  If you send it you must give me a proof of that and I will take the room offline  So the room is fix for you  No worries about my person  if needed I can give some reference  Your payed      will deducted of the full deposit                       That      you must bring cash when you will get your keys- also the first rent is payed cash when you got your keys  Then we sign the contract in person and I also hand you a signed registration form that is called  Wohnungsgeberbescheinigung   That form you need at the registration office ,https://www.wg-gesucht.de/wg-zimmer-in-Aachen-Aachen.7392589.html
Großes WG-Zimmer in engagierter WG und mit perfekter Lage,3,22,360,Jakobstr.,52064,48.0,0.10605,False,False,Das Zimmer ist das größte in der WG und hat einen schönen Ausblick in die grünen Bäume der Schanz     Im Moment ist eine der Wände orange gestrichen     Man hört relativ viel Straßenlärm vom Graben-Ring und Zügen  gewöhnt sich aber dran     Der Schrank  ein kleiner Nachttisch und das Sofa sollen mit übergeben werden      The room is the largest in the flat and has a beautiful view into the trees of Schanz     One of the walls is painted orange at the moment     There s quite some noise from the  Graben-Ring   the road around Aachen  and the train station close by  however for most people it is easy to get accustomed to it     The cabinet  a small bedside table and the sofa can be kept by the next person ,Die WG hat die perfekte Lage  wenn man schnell ist  dauert es von Wecker klingeln zu im Zug  Bahnhof Schanz  sitzen  min  es fahren regelmäßig Busse in alle möglichen Richtungen direkt vor der Haustür und man ist in   min zu Fuß am Hauptbahnhof      Gleichzeitig ist man auch in   min zu Fuß im Aachener Wald und kann entspannt spazieren gehen oder laufen     Die RWTH kann man mit allen Verkehrsmitteln in  -  min erreichen      The flat share has the perfect location  if you re quick  you can be in the train  train station Schanz  within   minutes after your alarm clock  buses in different directions stop frequently at the bus stop in front of the house and it takes a   min walk to get to the main station      However  it also only takes a   min walk to reach Aachen s forest for long walks or running in nature     RWTH can be reached within   to   min by any means of transport you choose ,Hallo zusammen     wir waren eine bunte WG mit zwei- und vierbeinigen engagierten Lebewesen und möchten es auch wieder werden      Meine Zwischenmitbewohner haben einen Platz im Wohnheim bekommen bzw  waren nur für ein  -monatiges Praktikum in Aachen  dementsprechend bin ich auf der Suche nach neuen Menschen  Erst einmal nur für zwei Monate  weil vielleicht mein Ex-Mitbewohner aus der Schweiz wieder zurück nach Aachen zieht  das steht aber noch nicht fest     Ich bin Svenja  habe ausschließlich zeitaufwändige Hobbies wie Musik und Pferde  studiere im Master Energietechnik und bin stets bemüht  Wege zu finden  mich für Klimaschutz zu engagieren und anderen Menschen Engagement zu erleichtern      Zu mir gehört Zeus  ein     jähriger wahrscheinlich Schäferhund-Mischling aus dem Tierschutz  Er ist freundlich und zurückhaltend und neuen Menschen vorsichtig gegenüber      Ich wünsche mir Menschen  die ebenfalls einen Sinn im Leben haben oder suchen  der über das Studium hinausgeht  und keine Angst vor Hunden oder eine Tierhaarallergie haben  Im Zusammenleben sind mir solche Sachen wie Mülltrennung und Benutzbarkeit und Sauberkeit der Küche wichtig  Und bitte nur Menschen  die nicht rauchen     In der Bewerbung freue ich mich über eine Antwort auf die folgenden Fragen  was ist eine Sache  die du an Deutschland gerne ändern würdest  konstruktive Kritik   Was ist dir super wichtig im Zusammenleben  Was sagst du zu kalt duschen  Wenn du nicht das machen würdest  was du gerade machst - was würdest du dann machen     Ich freue mich darauf  dich kennenzulernen      Hello people     our flat consists of two and four legged members      As my interim flatmates are moving out  one got a room in the student housing and one was only in Aachen for a   month internship   I am looking for new people  For now limited for two months  because one of my former flat mates might come back from Switzerland  which isn t fixed yet     I am Svenja  have exclusively time-consuming hobbies  am studying for a master s degree in energy technology  and am always trying to find new ways to get involved in climate protection and making it easier for others to get involved too      My room mate is Zeus  a     year old probably German Shepherd mix from animal welfare  He is friendly and careful  especially towards new people      For you to fit in our flat share and for us to fit to you  you should have or be looking for a purpose in live beyond your studies and neither be scared of dogs nor have a allergy towards animal hair  Please only non-smokers     In your application  we would love to have answers to the following questions  If there was one thing you could change about Germany  or your home country   what would it be  Only constructive criticism allowed  What is very important to you when living with other people  And what do you think about cold showers  If you didn t do what you are doing now - what would you do instead     We re looking forward to meet you ,Antworten werden am Freitag        verschickt  WG-Besichtigungen sind für Sonntag        geplant     You will receive a reply on Friday        viewings are planned for Sunday       ,https://www.wg-gesucht.de/wg-zimmer-in-Aachen-Aachen.7392589.html
"Traumhaftes Loft mit besten Mitbewohnenden (UNTERMIETE ab 01.08.2024, für 6z Monate)",5,18,475,Rudolfstraße,52070,48.0,-0.6401749999999999,False,False,Du hast das ruhigste Zimmer der WG mit einem großen Fenster und Bodenheizung  Ich vermiete das Zimmer komplett möbiliert  s  Fotos   Im Flur gibt es noch eine Kommode und ein großes Regal  wo du zusätzlich Kleidung und anderes verstauen kannst ,Das Loft liegt in einem ruhigen Hinterhaus zwischen dem Kaiser- und Hansemannplatz  Alle Haltestellen  Kaiserplatz  Hansemannplatz  Scheibenstraße  sind in weniger als   Minuten zu erreichen  In der direkten Umgebung findest du genügend Einkaufsläden  Penny  Norma  REWE  dm      sowie für frisches Obst und Gemüse unseren favorite türkischen Supermarkt AKSA  Für die etwas exklusiveren Ansprüche ist auch das Aquis Plaza nicht weit entfernt  Die Innenstadt ist fußläufig in weniger als    Minuten zu erreichen und auch zur Uni braucht man mit dem Fahrrad gerade einmal    Minuten      Das schöne  angrenzende Frankenberger-Viertel mit Park und auch der Stadtpark sind zu Fuß gut zu erreichen      Außerdem ist der Mehlkopf nicht zu vergessen  Hier kann man einen von uns jeden Sonntag in der Schlange treffen  um fürs WG Frühstück Brötchen zu holen ,Wir sind ein bunter Haufen und das macht unser sehr gemeinschaftliches  entspanntes WG-Leben auch aus      Ich hatte seit Tag   wirklich eine einzigartige Zeit hier  Ich vermiete das Zimmer unter  da ich wegen eines Praktikums für die nächsten   Monate unterwegs bin       Unten wohnen Linus und Louis  Linus      macht gerade seinen Master in Governance   Technology  aber am liebsten studiert er Kochbücher oder das Schachbrett  Er kann sich für alles mögliche begeistern  spielt Fußball im Verein und neuerdings auch Eishockey beim Hochschulsport  ist bei Kochabenden oder Glühwein sofort am Start und auch sonst für jegliche Sportarten und Unternehmungen zu haben  Vor allem die Kochabende können auch mal etwas ausgefeilter und größer werden  vom Thanksgiving Dinner bis zum Weihnachtsmenü  Louis      ist das neueste Mitglied unserer WG-Familie und studiert im zweiten Semester Maschinenbau  Loulu schwimmt leidenschaftlich gerne und versorgt einen auch noch nachts um   Uhr mit Nudeln   Pesto gegen das Katern  Zudem macht er gerne Schnappschüsse um diese dann in Sticker umzuwandeln und füllt immer alle Party-Gäste  mit Konsens natürlich  ab      Im Obergeschoss wohnen Torben      und Melina       Torben hat  Wirtschaftsingenieurwesen Maschinenbau studiert und arbeitet im Sustainability Consulting  Er fährt gerne bei schönem Wetter eine Runde Rennrad und spielt ebenfalls gerne Schach  Am liebsten haut er aber Sprüche raus     Die ein oder andere Runde Yoga findet in der oberen Etage aber auch gerne statt  Melina  mit dem ungewollten  aber von uns sehr gerne verwendeten Spitznamen Babsi oder von mir auch gerne Melini genannt  arbeitete im Marketing bei e GO  Sie findet tatsächlich manchmal die Motivation morgens vor der Arbeit noch ein Workout zu machen und ist sonst immer bei allem dabei  egal ob Badminton  Party oder den nächsten WG-Ausflug planen   Im Wohnzimmer findest du eigentlich immer jemanden mit dem du etwas kochen  Karten spielen oder entspannt ein Bier oder Wein trinken kannst  Unser Beamer wird auch immer gerne für gemeinsame Filmabende  sofern wir uns entscheiden können  genutzt   Neben Kochabenden  frühstücken wir gerne zusammen  aber nicht zu früh   denn direkt bei uns um die Ecke gibt s mit Mehlkopf den besten Bäcker der Stadt  Bei schönem Wetter auch immer gerne im Innenhof  wo man sich im Anschluss direkt sonnen kann  Generell nutzen wir den Innenhof alle sehr gerne und er bietet sich nicht nur zum Frühstücken und Grillen  sondern auch sehr gut für Partys an ,Wir beziehen grünen Strom und machen uns auch sonst Gedanken um die Welt      Wenn du Bock darauf hast  uns kennenzulernen  melde dich einfach  Schreibe uns am besten eine Nachricht und stell dich etwas vor  Dann können wir alles weitere  Besichtigung  Zoom  etc   klären      Achja  die Miete ist übrigens all inclusive          Wir freuen uns auf Dich       die R-  ,https://www.wg-gesucht.de/wg-zimmer-in-Aachen-Aachen.7392589.html
WG-Zimmer in netter 3er WG zur Untermiete,3,14,400,Rudolfstraße,52070,48.0,-0.75975,False,False,Da ich im kommenden Wintersemester ein Auslandssemester machen werde  möchte ich mein WG-Zimmer untervermieten     Das Zimmer ist ca     m  groß und hat ein großes Dachfenster  Trotz Dachschrägen ist das Zimmer gut geschnitten und dadurch sehr geräumig  Die Wohnung hat neben den   WG-Zimmern eine voll eingerichtete Küche mit ausziehbarem Esstisch und Platz für mindestens   Personen  Weiterhin sind neben Herd und Backofen eine Spülmaschine  ein großer Kühl- und Gefrierschrank und viele nützliche Küchenutensilien vorhanden  Es gibt ein großes Badezimmer mit Fenster  dass mit einer eigenen Waschmaschine ausgestattet ist  Zusätzlich gibt es ein getrenntes WC  Außerdem haben wir einen zusätzlichen Gemeinschaftsraum  ca   m    der mit einer selbstgebauten Bar und Sofas ausgestattet ist  Zuletzt gibt es noch ein geräumiges und trockenes Kellerabteil  Außerdem haben wir einen sehr guten Internetanschluss sowie zusätzliche LAN Anbindungen in alle WG Zimmer     Das Zimmer ist möbliert inklusive Schrank  Schreibtisch  Schreibtischstuhl  Nachttisch  Kommode und Bettrahmen und Lattenrost     m breit   Rollo  Hitzeschutz und ggf  Fernseher mit Soundbar ,Unsere WG befindet sich direkt am Rehmplatz im Dachgeschoss eines Mehrfamilienhauses und ist zu Fuß keine   Minuten vom Hansemannplatz entfernt  Hier fahren alle relevanten Buslinien in Richtung RWTH  Campus Mitte   min  und Hauptbahnhof    min  ab  Alternativ ist die Haltestelle Scheibenstraße ca    Gehminuten entfernt  Von hier fahren alle   Minuten Busse zum Bahnhof Rothe Erde  Beide Bahnhöfe sind zu Fuß in ca     Minuten zu erreichen     Der Campus Mitte ist mit dem Rad ebenfalls in    Minuten zu erreichen und damit ähnlich weit entfernt wie die Bahnhöfe     Außerdem ist die Innenstadt sehr nah  das Einkaufzentrum Aquis Plaza ist zu Fuß nur   Minuten entfernt  Weitere Einkaufsmöglichkeiten und Bäcker sind ebenfalls nur wenige Minuten entfernt      Die WG liegt ruhig  in der Mitte der Rudolfstraße  So ist es problemlos möglich mit offenen Fenstern zu schlafen oder zu lernen ,Die WG zeichnet sich vor allem dadurch aus  dass es keine Zweck-WG ist  Uns ist das freundschaftliche und aktive Miteinander sehr wichtig  Dein Mitbewohner Joshua ist    Jahre alt und studiert Informatik im Master  In seiner Freizeit fährt er gerne Rennrad  tanzt  spielt  Computer- Spiele oder trifft sich mit Freunden  Außerdem engagiert er sich bei Uni Urban Mobil   einer Initiative für nachhaltige Verkehrsentwicklung und Stadtkonzepte  Er ist offen und kommunikationsfreudig und auch immer für einen spontanen Plausch zu haben  Da der dritte Mitbewohner unserer WG in diesem Zeitraum ebenfalls ein Auslandssemester macht  kann ich zurzeit nur was über Joshua sagen      Die WG ist insgesamt auf ein offenes Miteinander ausgelegt  so wird zum Beispiel zusammen gekocht oder Essen bestellt  was schnell in einem Spieleabend endet  Wenn Du mal deine Ruhe haben möchtest  weil du beispielsweise eine stressige Phase hast  ist das natürlich gar kein Problem ,Die Vermieterin der Wohnung ist allgemein sehr zuverlässig  Das Haus pflegt einen freundlichen Umgang untereinander  so kommt es zu keinen Streitigkeiten mit anderen Mieter innen     Wenn du Interesse hast  dann schreib uns doch einfach ein paar Sätze über dich  Wir würden uns freuen  dich kennenzulernen   ,https://www.wg-gesucht.de/wg-zimmer-in-Aachen-Aachen.7392589.html
Große WG-Wohnung,4,15,376,Wilhelmstraße,52070,48.0,-0.9037999999999999,False,False,Das Zimmer liegt zur Straße hin  durch die Doppelfenster mit Luftzwischenraum ist von dieser aber kaum etwas zu hören  Gemäß einer Altbauwohnung hat das Zimmer schönen Parkettboden  hohe Decken und ist sehr hell     Es wird unmöbliert übergeben      Der Garten  das Herzstück der WG  ist durch die Wohnung umschlossen und damit nur für uns zugänglich  Hier kannst du im Sommer in Ruhe lesen und entspannen  deine Wäsche trocknen  Tischkicker spielen  Grillen mit Freunden  gute Gartenpartys feiern oder auch Blumen  Gemüse und Sträucher anpflanzen      Das Wohnzimmer dient sehr gut als Rückzugsort  wenn es draußen mal wieder kälter wird  Hier kann man schöne WG-Abende verbringen      Im Flur hast du viel Platz um dort dein Fahrrad abzustellen ,Die Haltestelle Normaluhr ist mehr oder weniger direkt vor der Haustür und ca    min weit entfernt  Der Hauptbahnhof ist in unter   min zu Fuß erreichbar     Der Weg zur Uni egal ob RWTH oder FH sollte also kein Problem darstellen  Zu Fuß ist die FH auch gut und mit einem sehr schönen Spaziergang durch Burtscheid zu erreichen      Der nächste Supermarkt ist ein Netto    min Fußweg   Rewe und Aldi sind aber auch nur    min zu Fuß weit entfernt ,Da ich für mein Studium Holzingenieurwesen wieder in meine Heimat für ein Praktikum ziehen werde  muss ich nun leider meine WG mit vielen schönen Erinnerungen verlassen      Wir suchen jetzt also eine n neue n Mitbewohner in  Hier leben Chris  der Lehramt im Master an der RWTH studiert  Nora  die bald Sozialearbeit studieren wird und Laurens  der gerade frisch seine Bachelorarbeit in Umweltingenieurswissenschaften abgeschlossen hat  Und unsere Hündin Lotti     Am besten lernen wir uns alle aber mal persönlich kennen          Wir freuen uns sehr über einen geselligen Menschen  der gerne Lust hat auf Gesselschaftsspiele  neulich haben wir Doppelkopf für uns entdeckt   Kochabende  gemeinsam mit uns Filme schaut oder viele andere Unternehmungen mit uns ausprobiert  Wir versuchen wenn möglich einen gemeinsamen WG-Termin pro Woche zu organisieren  Wenn man aber auch mal seine Ruhe braucht  ist das auch kein Problem und der Garten oder das eigene Zimmer ist ein perfekter Ort um sich zurückzuziehen      Die WG besitzt eigentlich alles was man so braucht  Garten  Spülmaschine  Waschmaschine  Tischkicker  Dartscheibe  Tischtennis  Bierpong-Tisch etc      Wenn du denkst  dass das für dich passt  freuen wir uns sehr von dir zu hören    ,Das Zimmer kann ab dem            übernommen werden     Die      Kaltmiete beziehen sich auf die gesamte Miete  mit allem drum und dran     Die Kaution beträgt       ,https://www.wg-gesucht.de/wg-zimmer-in-Aachen-Aachen.7392589.html
3er Wg direkt an der Schanz,3,16,400,Jakobstraße,52064,48.0,-0.5861500000000001,False,False,Hi       Ich ziehe ab Oktober für   Monate nach Köln für ein Praktikum  In der Zeit werde ich nach Köln ziehen und vermiete mein Zimmer daher unter     Die WG würde aus dir  Noah und Taiba bestehen  Noah ist ein Zahni im   Semester  Er liebt feiern gehen  techno und ist immer gut drauf  Taiba ist bereits fertig mit dem Studium und arbeitet im Moment  Sie hat aber sehr entspannte Arbeitszeiten  ist daher viel draussen unterwegs und immer bereit zu quatschen     Die Wohnung liegt im besten Viertel Aachens  nähe dem Bahnhof Schanz  Sie hat einen wunderschönen Ausblick aus dem Fenster über den Großteil der Stadt  Es ist alles vorhanden was man braucht und alles bereits im Preis inkludiert      Wir freuen euch dich kennenzulernen  Um das ganze bisschen Persönlicher zu machen  würden wir uns freuen wenn du in deiner Bewerbung hinzufügst  was dich diese Woche zum Lächeln Lachen gebracht hat ,Sehr zentral  Sowohl der Bahnhof Schanz als auch die Bushaltestelle Karlsgraben sind in einer minute zu erreichen  Supermärkte gibt es den Netto mit   Minuten Laufweg und einen Rewe mit    Minuten  Viele Restaurants im Umkreis von     Metern  Die Innenstadt ist ebenfalls in    Minuten zu Fuß zu erreichen und die Ponte in    Minuten ,Es gibt unterschiedlich Studiengänge in der Wg  was zu sehr verschiedenen Lernzyklen führt  Da wir uns aber sehr gut untereinander verstehen  ist die Atmosphäre in der Wg super  Wir quatschen andauern oder essen was zusammen etc  Es ist alles sehr unkompliziert  wir sind alle ungefähr gleich ordentlich und mögen die Wohnung schön sauber ,Ich bin lediglich für   Monate im Praktikum  und würde gerne anschliessend wieder einziehen  Daher ist das Mietangebot befristet ,https://www.wg-gesucht.de/wg-zimmer-in-Aachen-Aachen.7392589.html
2 Bed Room Apartment with Shared Kitchen and Bathroom,2,12,350,steinkaulstraße,52070,48.0,0.666825,False,False,This charming  -bedroom apartment is available to rent from July  The apartment offers an optimal room layout and good  fixtures and fittings that enable comfortable living    The separate  kitchen is equipped with fridge  stove  sink and  without furnishings    A good quality bed with slatted frame and mattress     x     cm  awaits you in the spacious room  ensuring a restful night s sleep  A big  closet offers good amount of storage space for your clothes  There is also a big table and an chair    The bathroom is equipped with a small tub  some space to keep products  and a mirror  Each window is fitted with curtains and the lighting is already installed ,A  noteworthy location for the apartment  It is located in Adalbertsteinweg  The apartment is on the  th  floor  The neighborhood is very friendly and quiet  The schibenstraße stop is just     m away and Blücherplatz is     m away  Within a  -minute walk you can reach the AKSA supermarket  which is open until   PM  Penny is just     m away  the bus station and Aachen Cathedral  Most of the RWTH buildings are a    -minute  from Bus Stop,The other flat mate is male  After work in kitchen keep the working  area in kitchen  clean and wash the utensils and share the duties of cleaning the common area like throwing trash ,Please note that due to the living space of approximately    square meters  the apartment is only rented to single persons  A parental guarantee or proof of sufficient income is required for the rental   Please start your request what do you normally when you are free This shows me that you have read the ad carefully and agree with the conditions ,https://www.wg-gesucht.de/wg-zimmer-in-Aachen-Aachen.7392589.html
"WG im Zentrum, neben dem Bahnhof Schanz",3,20,560,Mauerstr.,52064,48.0,-0.016149999999999998,False,False,Dreier-WG  mit Abstellraum  Keller  integrierter Küche und Waschmaschine  Bad getrennt von Nass und Trocken  Das Zimmer hat einen großen und schönen Kleiderschrank mit Ganzkörperspiegel     Die Preise beinhalten alle Nebenkosten  Strom und Internet  Vollständig möbliert  bezugsfertig      Dieses Zimmer bietet Platz für zwei Personen  Bei einer weiteren Person fallen zusätzliche Nebenkosten in Höhe von     Euro an ,Ideal gelegen in der Mauerstraße im Zentrum von Aachen  neben dem Bahnhof Schanz       Minuten zu Fuß von Rwth s Super C     Minuten zu Fuß von Netto      Minuten mit dem Bus von Aquis Plaza,WGs können online besichtigt werden ,Mindestmietdauer drei Monate  maximal ein Jahr   Der Mietvertrag kann später verlängert werden ,https://www.wg-gesucht.de/wg-zimmer-in-Aachen-Aachen.7392589.html
